id,submission_id,created_datetime_utc,author,score,body,sent,label
nehng7h,1nibdt3,2025-09-16T08:14:55+00:00,chookie94,32,"Pick 6 would be crazy for someone like Draper coming off a major injury.

Also, how would Brisbane afford two contracts that trigger band 1 given how many guns they have on their list?",-0.4019,neg
nehmf1t,1nibdt3,2025-09-16T08:04:19+00:00,StewSieBar,75,"Given he is coming back from an Achilles injury, surely the Lions won’t give him a contract that would trigger band 1? That would seem borderline irresponsible.",-0.4215,neg
nehmiyn,1nibdt3,2025-09-16T08:05:27+00:00,MillionKarma23,17,A tall Essendon player who’s getting older wanting to go to brisbane? I’ve seen this one.,0.0,neu
nehml8b,1nibdt3,2025-09-16T08:06:05+00:00,PetrifyGWENT,35,"Apparently its extremely unlikely to trigger band 1 due to his age. I think the number Cleary said was it would need to be $1.25m+ a year.

However there is some rumblings that we're prepared to ship Ridley off cheaper if Brisbane ensure we get band 1 off Drapers deal",0.5859,pos
nehmn0g,1nibdt3,2025-09-16T08:06:36+00:00,PetrifyGWENT,13,The only two players we will have lost to free agency are tall cult heroes to Brisbane,0.6486,pos
neho85d,1nibdt3,2025-09-16T08:23:00+00:00,StewSieBar,10,"Oh, I totally understand the recruitment. My team needs a ruck as well. It’s more that I don’t see Draper as a player that should be getting a band 1 salary. Too risky, especially with all the young talent the Lions have coming through. They will need a pay day sooner or later.",0.4019,pos
nehqu3v,1nibdt3,2025-09-16T08:50:02+00:00,jmaverick1,21,"Afl blocked any trading between st kilda and crows to stop this happening. 

But literally a couple days earlier they let Brisbane and essendon do shenanigans with daniher to get band 1. So who knows",-0.2846,neg
nehofqs,1nibdt3,2025-09-16T08:25:11+00:00,PetrifyGWENT,7,"Ridley is contracted and wants to go to Brisbane. We are prepared to let Ridley go for cheaper, if Draper gets band 1.",0.2263,pos
nehpou2,1nibdt3,2025-09-16T08:38:17+00:00,laserframe,3,"Oh that makes sense now, im guessing the bombers might have to chip in on the Ridley contract right? Like if Brisbane have to pay Draper a disproportionate amount then it would be the only way to balance the ledger?",0.3527,pos
nehqbrx,1nibdt3,2025-09-16T08:44:53+00:00,StewSieBar,6,Essendon could do the Ridley deal as a salary cap dump. Eg Essendon pays $300k per year of Ridley’s salary and Brisbane give them a better pick or player. But I don’t think the AFL will let them use that mechanism to increase the Draper compensation.,0.4767,pos
nehfhas,1ni9n1l,2025-09-16T06:53:50+00:00,CaptainLipto,14,"This finals series couldn't have gone better for the AFL than it has in terms of venues (and the revenue and attention that come from it).

First week of finals across Adelaide, Melbourne, Sydney and Perth. Second week in Adelaide and Brisbane. And now two sold out MCG prelims before the Big Dance.

Talk about a perfect spread across the major cities.",0.3169,pos
nehgnyj,1ni9n1l,2025-09-16T07:05:25+00:00,jwv92,18,"Add on that Brisbane have a solid Victorian fan base (only Sydney are bigger for non-victorian teams) and Brisbane currently travel pretty well too. This should beat the 83k crowd from last month and draw in plenty of neutrals on top of all that. 

I'm slightly hopeful that Pies/Lions could equal Cats/Hawks for attendance.",0.9002,pos
nehk28o,1ni9n1l,2025-09-16T07:39:53+00:00,Darth_Lehnsherr,7,On a sidenote the Pies wearing their 90s guernsey and the Lions wearing their usual Fitzroy style away kit looked so good especially under the MCG lights.,0.5777,pos
nehgrcf,1ni9h6w,2025-09-16T07:06:20+00:00,More_Arrival4622,1,the real news here is draper officially told the lions he will play for us next year ,0.34,pos
nehg8e3,1ni8ytm,2025-09-16T07:01:07+00:00,guseyk,2,Please seperate Bears and Lions,0.3182,pos
nei22km,1ni8ytm,2025-09-16T10:38:08+00:00,Tgrattan123,1,"Sydney was the last team to lose a final against Fitzroy in 1986. 

With the exception of the merged Brisbane Bears, Gold Coast (whose first finals series was this season) and Richmond (last final was the 1977 Elimination Final) Sydney has faced every club in a final at least once as Sydney.",-0.4019,neg
nehmlux,1ni8ytm,2025-09-16T08:06:16+00:00,Math_Opening,4,"I know, right? From 1995 onwards, Brisbane have played 43 Finals and Hawthorn 36, but none against each other. It's mainly because each club has been dominant while the other has been on the slide.

**Brisbane played Finals from 1995 to 2004**, except 1998, when they won the wooden spoon! During that period, Hawthorn only played Finals in 2000 (8th) and 2001 (6th). In 2000, both clubs won Elim Finals, but lost their semi-finals. In 2001, the Hawks also won an Elim + Semi, but were drawn against Essendon in the Prelim.

**Hawthorn played Finals from 2007 to 2018**, except for 2009 (9th) and 2017 (12th). The only year Brisbane played Finals in that whole stretch was 2009!

**Brisbane have played Finals from 2019 to 2025**. 2019 was the beginning of Hawthorn's mini-slump: 9th, 15th, 14th, 13th, 16th. As we all know, Hokball started up in 2024, but their only chance of playing Brisbane was to reach the Grand Final. Ditto for 2025.",0.9905,pos
nehknlh,1ni8ytm,2025-09-16T07:45:58+00:00,Math_Opening,3,"Naw, they is frendz

https://preview.redd.it/hbsk2wchdhpf1.png?width=469&format=png&auto=webp&s=57e7b5464bd41d15564ab8e45d31287823a7caa2

Brisbane Bears played four Finals prior to 1997:

**1995 QF**: 1st Carlton 13.12 (90) def 8th Brisbane 12.5 (77)  
**1996 QF**: 3rd Brisbane 15.11 (101) def 6th Essendon 15.10 (100)  
**1996 SF**: 3rd Brisbane 26.14 (170) def 5th Carlton 10.13 (73)  
**1996 PF**: 2nd North Melb 17.12 (114) def 3rd Brisbane 11.10 (76)

So, that's two wins and two losses for the Bears if you want to treat them as a distinct club. 

Which, honestly, they really weren't. Not many Fitzroy players ended up having meaningful careers with the merged club, more went on to play for other clubs entirely, or simply never played AFL again.",0.9409,pos
nehl75d,1ni8ytm,2025-09-16T07:51:41+00:00,guseyk,-2,It's not about players in the merged club and I agree it's moot with regard to finals but to consider Fitzroy separately and to merge Bears and Lions statistics is highly offensive to Fitzroy people who followed them into the Brisbane Lions.,-0.5704,neg
nehn5nj,1ni8ytm,2025-09-16T08:11:54+00:00,Math_Opening,5,"Highly offensive? 🤔😯

EDIT: For the record, the following players all played significant roles in the Bears reaching a Prelim Final in 1996, and the Lions winning the 2001 Premiership.

Alastair Lynch  
Chris Scott  
Craig McRae  
Darryl White  
Jason Akermanis  
Justin Leppitsch  
Marcus Ashcroft  
Matthew Kennedy  
Michael Voss  
Nigel Lappin  
Shaun Hart

Perhaps supporters of AFL in Brisbane from 1987 to 2025 might find it 'offensive' (or at the very least confusing) that the achievements of the teams of 1995 and 1996 have to be kept quarantined from the teams of 1997 to 2025?",0.8109,pos
negsllb,1ni6s3q,2025-09-16T03:41:37+00:00,pommedeterre96,18,"Cats look like the best team, and they should win it (probably by beating Brisbane).

However, I wouldn't be surprised if Collingwood manage to shithouse their way to another flag.",0.7804,pos
negrwky,1ni6s3q,2025-09-16T03:36:43+00:00,Mother_Sun_3825,9,"Geelong and Hawks v Collingwood - I think it’s a close and entertaining grand final 

Geelong v Brisbane - I think Geelong could slaughter Brisbane",0.7096,pos
negquk9,1ni6s3q,2025-09-16T03:29:17+00:00,doshajudgement,6,geelong beats brisbane I reckon ,0.0,neu
negtlsv,1ni6s3q,2025-09-16T03:48:49+00:00,PatientDue8406,6,"Hopefully Brisbane but if not then.....I can't believe I'm saying this.....the pies.

Unfortunately I think the cats might take it though.",-0.3071,neg
negt86c,1ni6s3q,2025-09-16T03:46:06+00:00,NuuuDaBeast,7,I have a feeling that the teams that beat the Crows will be in for a rude awakening. Crows were already the worst transition team but those two finals were some unwatchable football. I think the Lions shock people and make the grand final.,-0.4019,neg
nehxnem,1ni6s3q,2025-09-16T09:58:36+00:00,tbot888,2,"Brisbane.  They are just getting started.

But honestly the coliwobbles are always a good show.  Plus would be an epic way for Pendlebury to go out.  Great footballer",0.9382,pos
negqywp,1ni6s3q,2025-09-16T03:30:06+00:00,Bourkey_94,5,"Geelong Brisbane GF and it breaks my heart to say it but I think the cats win. They are an elite team, no weaknesses anywhere.",0.0387,neu
neh6wt0,1ni6s3q,2025-09-16T05:33:34+00:00,Himawari_Uzumaki,2,I want Geelong vs Brisbane but bad feeling it'll be Collingwood vs Hawthorn,-0.5927,neg
nei1rht,1ni6s3q,2025-09-16T10:35:32+00:00,cAmaturehOur,1,"Brisbane have to many injuries.
Hawthorn don't have the star power.

It'll be a Geelong Collingwood GF with Geelong winning. Unfortunately.",0.25,pos
neh6xk6,1ni6s3q,2025-09-16T05:33:45+00:00,Jackaddler,1,"My tip (unfortunately) is Hawthorn to beat Collingwood

But here is my tip for each possible match up 

Hawthorn to beat Collingwood

Collingwood to beat Geelong

Geelong to beat Brisbane 

Hawthorn to beat Brisbane",0.0,neu
nehf8bj,1ni6s3q,2025-09-16T06:51:27+00:00,bundy554,1,My bet is Geelong v Brisbane - I think Collingwood will choke again,-0.5423,neg
negt9ny,1ni6s3q,2025-09-16T03:46:24+00:00,Direct-Expression-47,2,"Interesting take, Brisbane beat them 2x during the home and away. Granted they were belted in the prelim but I took that as out if the box rather than a given",0.3291,pos
neh0kkw,1ni65wv,2025-09-16T04:41:22+00:00,richwithoutmoney,3,"Appreciate you clarifying/changing the Lions to GWS as there's almost no way we'd ever be in the market for him tbh, so I was very confused why he would nominate us.",-0.2648,neg
negpyxm,1ni65wv,2025-09-16T03:23:21+00:00,lanadeltaco13,3,"Left in 2019. All my family live there and my wife and I couldn’t disagree more. Every time we go back we are amazed at how it is the exact same place. 


Now Brisbane, that’s a city that which is always changing",0.1531,pos
neh4bdq,1ni65wv,2025-09-16T05:11:19+00:00,lanadeltaco13,0,"I think the truth is somewhere in the middle and we’re both right. It has changed. But the problem with its change is that it’s still 30-50 years + behind the rest of the country. A good example being what they’re doing with South Road. That’ll take another ten years to finish and all of a sudden Adelaide has one super highway to drive on. By comparison I can think of at least 8 in Brisbane.


I think it’s arguably worse than the place I grew up in. Take Glenelg for example. Derelict, neglected and dead. I couldn’t believe how shit it was the last time I went. My problem with Adelaide is that the people make these sort of statements all the time but they never go further and explain what it is that’s changed or is so great. 


I should keep this football related though. Its football teams are certainly a lot shitter now compared to when I grew up, well one of them anyway",-0.7382,neg
neghc2j,1ni4zs3,2025-09-16T02:27:34+00:00,Yesterday_Jolly,4,If he really wants to leave he will somehow end up at Brisbane or Geelong,-0.1189,neg
nei03wx,1ni4emj,2025-09-16T10:21:06+00:00,SpaceOdyssey3,1,"Don’t go for Freo, but does pre-lions Neale get a sniff or did Fyfe just outshine him?",0.0,neu
negdwhf,1ni4emj,2025-09-16T02:06:50+00:00,lacrossebilly,8,Lions legend Josh Green,0.0,neu
neh40s7,1ni4emj,2025-09-16T05:08:51+00:00,Ploasd,3,Lions legend Luke hodge,0.0,neu
nehdizq,1ni3jcd,2025-09-16T06:35:03+00:00,lottowinnerau,4,Probably Barwon Heads 😜 (Lions supporter here),0.2732,pos
nefpvhi,1ni1rf5,2025-09-15T23:46:04+00:00,NuuuDaBeast,17,"all Hawks fans talk about is their midfield. Fans talk about how one flag would make it all worth it and Zerrett would make a huge difference. Just look at how one or a few notable midfielders made a huge difference for Brisbane and Geelong. Lions got Ashcroft, Dunkley and instantly shot up. We got Bailey and then Max suddenly has a career best year. Atkins also benefitted hugely. 

People are really underestimating how much effect putting a great player into a good team has, especially one that will touch the ball 30+ times. Put another elite midfielder into Geelong right now and I don’t think we’d ever lose a game. None of these other young players will have more effect than 4 years of Merrett, their other midfielders will all have career years.",0.9493,pos
nefqagr,1ni1rf5,2025-09-15T23:48:28+00:00,GuidingBolt1998,12,"yeah talk is cheap and hypotheticals are always fun in theory, guarantee the fans would riot if any of those players were traded.  
Also weren't geelong leading in a prelim without bailey last year?

Think you're overrating the midfield here lol, Dogs literally have the best midfield on paper by a mile and they couldnt make the 8. Freo have 3 AA calibre players with Brayshaw, Young, Serong. GCS have Touk, Rowell, Anderson and lost to Brisbane without Neale. 30+ touches in a midfield means fuck all if the rest of the system isnt elite, which is what Geelong have.",0.6249,pos
nefukua,1ni1rf5,2025-09-16T00:13:28+00:00,NuuuDaBeast,3,"I strongly believe if we had Bailey last year we easily run out Brisbane which disproves your point. Cats ended up losing the game purely off Brisbanes midfield. 

Trading any one of those young players doesn’t ruin structure to the degree of potential midfield improvement. Hawthorn are clearly a more structured team than any of those elite midfield teams, so in this case yes a midfield upgrade would exponentially improve them. Yes obviously fans would be mad because we all overrate our own players, but they would settle down when Hawthorn win even more and Zach is leading the Brownlow.

Bailey literally just jumped into an already great team and acted as the fuel to the system. That alone made him BoG for most games. Zach would do this to Hawthorn but even better. A great team already without a great midfield becomes one of the best teams with a midfield upgrade. A mediocre team with a great midfield become flat track bullies.",0.9925,pos
nefrb81,1ni1gvy,2025-09-15T23:54:17+00:00,john-fuchsia-auntie,17,"Essendon - Pick 8 from Hawks, Future 1st from Hawks, Zac Bailey, Cam McKenzie

Hawthorn - Zach Merrett, Future 3rd from Lions, Future 4th from Lions 

Brisbane - Jordan Ridley, Future 2nd from Bombers, Future 4th from Hawks",0.0,neu
nefobg2,1ni1gvy,2025-09-15T23:37:09+00:00,Admirable_Message497,1,All of this just for Merrett to nominate Brisbane or st kilda,0.0,neu
neghco9,1ni1gvy,2025-09-16T02:27:40+00:00,space-c0yote,-1,"Here's my proposed 5 club Multi Trade. Pick numbers are after Oscar Allen and Sam Draper compensation, and Draper is assumed to be band 1 as part of Brisbane's deal for Ridley. Starcevich is included to avoid diluting West Coast's compensation.

Essendon: 
1, 10, 28, F1 (Hawthorn), F2 (Hawthorn), McKenzie 
for
6, 24, Merrett, Ridley, F2

Hawthorn:
Merrett, F2 (Essendon)
for
10, 28, F1, F2, Cam McKenzie 

Brisbane:
Ridley
for
19, Starcevich

Gold Coast:
19, 24, 53
for
8

West Coast:
6, 8, Starcevich 
for
1, 53",-0.296,neg
negaay4,1ni1gvy,2025-09-16T01:45:48+00:00,lilhoot24,1,Essendon sign up. Lions and Hawks laugh in your face and leave with that sort of offer,0.5267,pos
nefnkku,1ni1gvy,2025-09-15T23:32:56+00:00,EfficientNews8922,10,"If I was Brisbane, I’d be making enquiries right now about that",0.0,neu
nefzi1c,1ni1gvy,2025-09-16T00:42:41+00:00,Magictoast9,4,The lions are getting fleeced by that deal lol,0.4215,pos
neg483u,1ni1gvy,2025-09-16T01:10:11+00:00,disko_robot,3,"Bailey's FA and Ridleys contracted to 2029

Lions prob get more here than just letting bailey walk and having to pay straight up for ridley in 2 different deals if im not mistaken.",0.3839,pos
neg41vd,1ni1gvy,2025-09-16T01:09:09+00:00,Magictoast9,2,"You're way over valuing Ridley and undervaluing Bailey. Ridley is horrifically injury prone and plays his best footy as a spare in defence, which there are always a surplus of. He's not worth a first round pick. 

Bailey is not injury prone, much younger, one of Brisbane's most important forward mids. Not easy players to replace. He's worth more than two second rounders.",-0.4845,neg
neghm7b,1ni1gvy,2025-09-16T02:29:17+00:00,EfficientNews8922,3,I’m not suggesting you go chase him or that you give up Bailey willingly. I’m talking about if Bailey decides he wants to go to take that massive money at Essendon and how Brisbane can get the best return.,0.6369,pos
nedhoxf,1nhpx29,2025-09-15T16:54:07+00:00,jubbjubbs4,22,"With free agency nowadays its pretty rare for older players to end up getting traded instead of just moving through free agency which makes it harder to find comparisons.

The best comp i can think of is Dayne Beams in 2018. He was 28 at that point and got traded for effectively 2 firsts.

He had won 3 straight bnfs at brisbane whereas merrett is about to win his 6th crichton so they're not dissimilar in some ways.

Full trade is below but it was basically beams + two 3rds for 2 firsts + a 3rd.
https://www.draftguru.com.au/trades/2018-dayne-beams",0.9209,pos
nedsjpr,1nhpx29,2025-09-15T17:45:18+00:00,FirstTimePlayer,3,"It is worth acknowledging I used Pick 10 as a hard cut-off - its entirely plausible there is a blockbuster trade of Pick 11 for a 30 year old out there somewhere I have forgotten about.

The Beams deal was also a little weird - Brisbane wanted top dollar and were 100% prepared to refuse any trade, and Collingwood were also in need of draft points without any real care about actual draft position, which is why the deal finished up with an odd pick shuffle and the Lions manufacturing the 2nd late first round pick in the trade.

Still, Beams is a decent discussion point. You do occasionally see end of 1st round picks get shuffled for quality players approaching 30, but that is a decent amount away from the premium clubs put on top 10 picks.",0.2576,pos
nefp86t,1nhpx29,2025-09-15T23:42:21+00:00,jubbjubbs4,2,">Brisbane wanted top dollar and were 100% prepared to refuse any trade, and Collingwood were also in need of draft points without any real care about actual draft position

To a degree this is the same with merrett. At least publicly essendon are posiitioning that they will hold him to his contract unless they get top dollar.

As someone else pointed out, i mixed up my medals with beams so he had won 3 straight qclash bog but he only had 1 bnf compared to zach's 6.",0.4152,pos
nece6c7,1nhknh0,2025-09-15T13:37:26+00:00,Thanks-Basil,5,Suns have a strange habit of overlooking players in their backyard. They refused to draft Zorko for like 5 years in a row as he won the Broadbeach B&F ever year; until Brisbane eventually traded for the rights to draft him (probably explains why he hates the suns so much),0.0772,pos
necfvsp,1nhknh0,2025-09-15T13:46:48+00:00,Maximumlnsanity,1,"I feel like every club has that star player who was right under their nose and they just failed to recognise. We had Luke Breust in our academy, the Hawks had Gary Ablett Sr on their list. West Coast didn’t draft Nic Martin multiple times, Suns with Zorko, Lions with Ben Keays, etc.",-0.2023,neg
necxcr0,1nhknh0,2025-09-15T15:15:05+00:00,Tiny_Sherbet8298,9,Keays had way too many chances at Brisbane to even be even remotely similar to the other guys.,0.2023,pos
nef8kwh,1nhjwkc,2025-09-15T22:05:42+00:00,SufferButWhy,1,"I was at Geelong Brisbane and there was a guy walking through the line checking membership cards.

You could probably use your mates card or use a screenshot from the MCC app if you kind of look like them (I look nothing like my ten year old photo). Just watch out for someone walking through checking and try to avoid them in the first instance I think.",0.4215,pos
nebm1il,1nhhi3n,2025-09-15T10:25:41+00:00,kdavva74,13,"Getting key dynasty players into your footy set-up seems to generally be a pretty good idea. Pretty likely that two Brisbane premiership players are gonna be coaching against eachother in the grand final in a couple of weeks' time. Already a few Geelong 07-09 guys very highly rated as assistant coaches/list managers like Enright, Mackie, Steven King, Scarlett etc

edit: Fagan and Mitchell both involved in the Hawks three-peat as well obviously",0.9423,pos
neb2dg9,1nhec4v,2025-09-15T07:04:59+00:00,laserframe,1,"Ok so 8, F1 and steak knive.  All though I think Mckenzie is the one with more possible upside, only 21, another preseason and I would think he would be an instant starter for the Bombers



The question is what does Essendon do with all those picks

They currently have 4,5,22,25.  Draper leaving via free agency might trigger band 1 which would give them pick 6 as well.  Will Ridley pursue a trade to the Lions?  If so one would think they will get at least pick 16 for him. Merrett and Ridley leaving would leave a huge hole in cap space.

Bombers should be trying to throw the kitchen sink at Petracca.  A bit like Merrett he won't be about for your next flag tilt but geez you could use that quality of midfielder to rebuild with, plus you would have the sort of draft hand to satisfy the Dees.",0.9255,pos
neb75n6,1nhec4v,2025-09-15T07:53:19+00:00,MilkByHomelander,1,"Yeah, but the evidence is there to suggest he will.

He's not an injury prone player, never has been. His performances aren't going to dramatically drop the older he gets because he doesn't rely on anything physical to be the player he is. Merrett is always looking at ways to adapt himself and his body as well, hes said as much in interviews. 

Unless he has a horror injury which could happen to literally any player any day, I don't think he's going to just suddenly drop off. Dude loves the sport more than anything, he'll want to keep playing for as long as he can. 

I'd have more worry about Draper playing his full 5 years for Brisbane without dropping off completely than I would about Merrett dropping off before he turns 36.",0.5433,pos
