id,submission_id,created_datetime_utc,author,score,body,sent,label
ndz1idj,1nfrt5h,2025-09-13T10:50:54+00:00,Chaisa,8,"Watching this game makes me stunned just how well the Suns went at clearance in the last game the two teams played.

Lions do look back to their best. Next week (assuming the Suns don't come back) will be intriguing.",0.8074,pos
ndz4ryi,1nfrt5h,2025-09-13T11:18:50+00:00,Admirable_Message497,8,Collingwood vs Brisbane and Hawthorn vs Geelong. The 2000s are so alive,0.5214,pos
ndz6nrl,1nfrt5h,2025-09-13T11:34:07+00:00,Von_Huge1103,7,Do Brisbane need the threat of elimination to be the best team in footy or something?,0.2023,pos
ndzbatf,1nfrt5h,2025-09-13T12:08:24+00:00,The_Driving-Crooner1,8,Never write off Brisbane. Champion team.,0.5994,pos
ndym2kq,1nfrt5h,2025-09-13T08:20:08+00:00,OzNTM,6,Go Lions!,0.0,neu
ndyufy8,1nfrt5h,2025-09-13T09:44:53+00:00,Realistic-Box2443,7,"Super fascinating mental matchup tonight: suns have that “this is new territory let’s just see what happens, how good is September??” Vs the “we cannot straight set this because of the suns, we have to win. Must win. We are reigning premiers. Pls. Pls, lions”",0.9595,pos
ndz90zw,1nfrt5h,2025-09-13T11:52:15+00:00,PhaseChemical7673,6,You lions fans will rue these behinds when we kick 10 in a row I. The last 5 minutes,0.0,neu
ndyljah,1nfrt5h,2025-09-13T08:14:45+00:00,papleypadre,5,"Brisbane really did all that last season just to destroy us, now that we aren't in the finals they decide to play poopy. got it",-0.2732,neg
ndylnx9,1nfrt5h,2025-09-13T08:16:02+00:00,Duskfiresque,6,Brisbane will win comfortably.,0.765,pos
ndys06e,1nfrt5h,2025-09-13T09:20:17+00:00,canary_kirby,5,"R/AFL:  GET BEHIND THE SUNS… LIONS WON LAST YEAR

THIS YEAR ITS TIME FOR THE SUNS

WHEREVER YOU ARE… FACE TOWARDS THE GABBA, STAND TALL AND… FEARLESS!!!!!!!

UP THE MIGHTY SUNS!!!!!

🔴🟡🔴🟡🔴🟡🔴🟡🔴🟡🔴🟡",0.765,pos
ndz4v87,1nfrt5h,2025-09-13T11:19:34+00:00,PhaseChemical7673,6,"Ah well, Brisbane too good. Nothing but the Sun god Ra can save us now",0.8573,pos
ndz4vvn,1nfrt5h,2025-09-13T11:19:44+00:00,canary_kirby,7,"I am officially calling the win for……

BRISBANE!!!

🦁🦁🦁🦁🦁

Well done LIONS… Through to a prelim.

PLEASE BEAT THE PIES AT THE ‘G… and if necessary please do the needful and don’t let the hawks get the flag.

UP THE MIGHTY LIONS!!!’n",0.9081,pos
ndz6lc7,1nfrt5h,2025-09-13T11:33:35+00:00,chaosarcadeV2,6,Brisbane’s players have just decided they can’t be tackled,0.0,neu
ndz7mmr,1nfrt5h,2025-09-13T11:41:39+00:00,Even_Switch59,6,"Big fourth quarter Lions, cone on boys bring it home",0.0,neu
ndz861l,1nfrt5h,2025-09-13T11:45:48+00:00,Coletrain44,5,"Brisbane Bros, are we back?",0.0,neu
ndzamup,1nfrt5h,2025-09-13T12:03:47+00:00,iliketoeatwatermelon,6,Why is BT talking about Brisbane rebuilding? They’re about to play a prelim lmao,0.743,pos
ndz1l8e,1nfrt5h,2025-09-13T10:51:36+00:00,Darth_Lehnsherr,10,Dunkley coming to the Lions was the missing piece we needed to be Premiership contenders.,-0.296,neg
ndzbyml,1nfrt5h,2025-09-13T12:13:00+00:00,OverQualifiedFailure,11,Even as a Brisbane fan this game has been boring after 3qt time…,0.0,neu
ndyrwt7,1nfrt5h,2025-09-13T09:19:20+00:00,PointOfFingers,5,Dimma struggling with the travel.  Punt Rd to Docklands was hard but Gold Coast to Brisbane was brutal. Had to travel up yesterday.,-0.8294,neg
ndyu4s7,1nfrt5h,2025-09-13T09:41:49+00:00,ExerciseKey9035,5,"Brisbane supports seeing a blow out on the books

![gif](giphy|l4FATJpd4LWgeruTK)",0.4199,pos
ndyzmqs,1nfrt5h,2025-09-13T10:34:06+00:00,Appropriate-Cow-6251,5,"Gee this channel 7 commentary is biased towards Brisbane, although I shouldn’t be suprised",-0.2732,neg
ndz19xd,1nfrt5h,2025-09-13T10:48:50+00:00,Immediate-Ad5804,6,All I want is some good bloody finals football. This is too easy for the Lions.,0.4939,pos
ndz5m6i,1nfrt5h,2025-09-13T11:25:45+00:00,SurePie7330,6,GC should’ve renamed themselves to the Washington Generals for tonight’s match..they’re making the Lions look like the Harlem Globetrotters tonight,0.3612,pos
ndz6ez0,1nfrt5h,2025-09-13T11:32:12+00:00,JustSomeBloke5353,5,The pressure differential from Geelong last week to GC this week is phenomenal. Making the Lions look like world beaters.,0.0772,pos
ndz71j3,1nfrt5h,2025-09-13T11:37:07+00:00,paulmp,5,I was expecting the Lions song then... we have a whole quarter to go,0.0,neu
ndz8ekj,1nfrt5h,2025-09-13T11:47:35+00:00,024_naMsdrawkcaBehT,4,Suns should try kicking to Lions players so when they miss they might hit up their own guys,-0.2177,neg
ndz8mfi,1nfrt5h,2025-09-13T11:49:13+00:00,TraditionalSink3855,6,Brisbane came out so fucking hard tonight so that we’ll never have to hear the Suns song after the siren ever again … this year,-0.2433,neg
ndz8zsd,1nfrt5h,2025-09-13T11:52:00+00:00,Grommzz,5,"Every Brisbane shot.. 

Ohhh that would have bought the house down.",0.0,neu
ndz8zxa,1nfrt5h,2025-09-13T11:52:01+00:00,pigsdontflyhigh,5,"This game is like that copy pasta ""They had me in the first half (quarter)"". Lions just too good",0.6597,pos
ndz9117,1nfrt5h,2025-09-13T11:52:15+00:00,MediumForeign4028,6,"Points only for Brisbane from now on, to try and make it a bit challenging.",0.1531,pos
ndzawck,1nfrt5h,2025-09-13T12:05:36+00:00,Gojirahawk,5,Seeing ads for Victoria on the sidelines .. I’m sure the airlines are not gonna surge their prices from Brisbane to Melbourne over the next week .. possibly two,0.3182,pos
ndz1h7z,1nfrt5h,2025-09-13T10:50:37+00:00,Tosslebugmy,8,"If lions win, the prelim finalists will have a combined 14 of the last 24 premierships (will be 15 of 25 after the GF, which is 60%).",0.5859,pos
ndylx36,1nfrt5h,2025-09-13T08:18:37+00:00,Korasuka,4,"Brisbane when they wear their Fitzroy kit (red, blue, gold) vs Gold Coast (blue, red, gold). 

Close enough. We're still in it!",0.0,neu
ndyo2rk,1nfrt5h,2025-09-13T08:40:40+00:00,MillionKarma23,5,Go lions,0.0,neu
ndytdf2,1nfrt5h,2025-09-13T09:34:09+00:00,Mega-Metagross,4,"I’m eating pizza dipped in butter chicken sauce, let’s go lions get it done",0.0,neu
ndytvuz,1nfrt5h,2025-09-13T09:39:20+00:00,bales1986,4,"Suns are rocking pink tonight! On style points Brisbane are behind, stay tuned for more deep meta analysis.",0.0,neu
ndyvdqw,1nfrt5h,2025-09-13T09:53:58+00:00,papleypadre,5,Lions love the horizontal kicks tonight,0.6369,pos
ndyxmz6,1nfrt5h,2025-09-13T10:15:30+00:00,Decent_Fig_5218,4,Alex Davies with some shocking disposals in this game so far. Straight up giving the ball away to Brisbane,0.2212,pos
ndyxrpl,1nfrt5h,2025-09-13T10:16:45+00:00,fatb4t,5,"Fox commentary talk positively about the Lions (excluding Brownie trying to put sentences together), challenge impossibru",0.5994,pos
ndyyloi,1nfrt5h,2025-09-13T10:24:30+00:00,hough_stuff69,4,"When the lions draft me with pick 18, my goal songs gonna be Flagpole Sitta",0.0,neu
ndyz00u,1nfrt5h,2025-09-13T10:28:14+00:00,NoUseForALagwagon,4,"Anybody that plays Football Manager would know that the Lions are getting FM'd right now.

Dominate everything and it's somehow 1-1.",0.128,pos
ndyz990,1nfrt5h,2025-09-13T10:30:38+00:00,annoyingcheese,4,I thought the advantage rule can’t be paid unless the team has possession. So in that instance the ball was on the ground at the point (even though lions clearly were going to pick it up first)???,0.6416,pos
ndz0qr8,1nfrt5h,2025-09-13T10:44:10+00:00,swagmaster778,5,"Hodgey commentating as a Brisbane fan gets quite exhausting, he has a tone of voice he does complaining about things in Brisbane games alone",-0.5095,neg
ndz12zk,1nfrt5h,2025-09-13T10:47:09+00:00,bmk14,4,Lions tackling pressure has been elite. Actual and perceived pressure so visible in the suns movement and disposal.,-0.5267,neg
ndz24pr,1nfrt5h,2025-09-13T10:56:20+00:00,NuuuDaBeast,5,the QF switched the narrative so quickly. Lions have looked great with this exact list and have backed up losses with statement wins all year. They dominated Hawthorn and trounced Freo under a month ago,0.7351,pos
ndz4u9w,1nfrt5h,2025-09-13T11:19:21+00:00,Intelligent-Row-7320,4,Brisbane all year have kicked so many goals from what looks like a certain turnover. Insane,0.2263,pos
ndz65ae,1nfrt5h,2025-09-13T11:30:04+00:00,canary_kirby,5,"ITS THE YEAR OF THE LION

I WANTED SUNS TO WIN

BUT NOW… I WANT THE LIONS TO GO ALL THE WAY

GO LIONS!!!!  THE FLAG IS YOURS FOR THE TAKING",0.6147,pos
ndz6csv,1nfrt5h,2025-09-13T11:31:42+00:00,lexirayne03,5,Collins has to defend not only the Lions forwards but also his own teammates. Rioli getting in the road there.,0.0,neu
ndz9801,1nfrt5h,2025-09-13T11:53:41+00:00,Adorable-Pilot4765,6,Do the Suns realise Harris Andrews plays for Brisbane?,0.25,pos
ndzal8e,1nfrt5h,2025-09-13T12:03:28+00:00,Darth_Lehnsherr,4,There's like 8 players 22 and under playing tonight for Brisbane BT,0.5106,pos
ndylbzi,1nfrt5h,2025-09-13T08:12:44+00:00,___TheIllusiveMan___,6,Does anyone know if it’s a charity game today? Need to know if Brisbane have cursed themselves,0.4215,pos
ndyuinq,1nfrt5h,2025-09-13T09:45:38+00:00,Pleasant-Role1912,7,Crowd booing for a Lions 50m at the Gabba is wild ,0.0,neu
ndz3a0u,1nfrt5h,2025-09-13T11:06:08+00:00,ComfortableExtra1758,7,The scared fan in me still expects this to be close. GC with nothing to lose here and Brisbane love letting their guard down for a quarter.,0.7057,pos
ndysd8n,1nfrt5h,2025-09-13T09:23:57+00:00,twerkingiswerking,8,Say what you will about Brisbane but if you don’t like Fagan you may well be a flog.,0.7096,pos
ndyncxd,1nfrt5h,2025-09-13T08:33:17+00:00,Critback,3,"As much as I'd love the Suns to win this is where I see the finals experience proving the difference this week.

Lions by 4 goals.",0.8402,pos
ndyrrje,1nfrt5h,2025-09-13T09:17:51+00:00,Gojirahawk,3,"Swamp Thing posted a stat. If Brisbane win this match, then Fagan will be become the Brissy Coach to head coach the most finals games for Bris Vegas. I don’t think that accounts for Fitzroy Lions coaches

Edited for most important part",0.7089,pos
ndytpj6,1nfrt5h,2025-09-13T09:37:31+00:00,acllive,3,Hahahah every lions player has done the Simpsons sideburns trim,0.0,neu
ndyu7rv,1nfrt5h,2025-09-13T09:42:39+00:00,Liquid_Plasma,3,Hope Brisbane put their sun screen on because the suns are starting off hot.,0.4404,pos
ndyua4a,1nfrt5h,2025-09-13T09:43:16+00:00,Jackaddler,3,As much I like the Suns pink guernsey it isn’t the best clash against the Lions. Don’t they have a blue and yellow clash jumper?,0.7717,pos
ndywvsn,1nfrt5h,2025-09-13T10:08:20+00:00,MJBrowny19,3,"Perfect start for Lions, Howie? What?",0.6199,pos
ndyx3z7,1nfrt5h,2025-09-13T10:10:30+00:00,Even_Switch59,3,LFG lions 🦁 👏,0.0,neu
ndyyd3r,1nfrt5h,2025-09-13T10:22:19+00:00,freemyw1lly,3,"Feel like last week showed if you tag McCluggage Brisbane seriously struggle

Why would you not be doing that Dimma?",-0.128,neg
ndyzpzw,1nfrt5h,2025-09-13T10:34:55+00:00,blaze_bayley,3,Brisbane are all over GC at the moment...,0.0,neu
ndyzw8z,1nfrt5h,2025-09-13T10:36:29+00:00,Striking_Resist_6022,3,Rowell looked like he was wearing the Lions indigenous jumper for a moment there,0.3612,pos
ndyzy3z,1nfrt5h,2025-09-13T10:36:57+00:00,eathbau,3,Who's the chemist at Brisbane? 4 game player looks like a gorilla.,0.3612,pos
ndyzykk,1nfrt5h,2025-09-13T10:37:04+00:00,zircosil01,3,Danger period for the suns. If Brisbane nail a couple more goals it'll pump the pressure up to 100,-0.6808,neg
ndz03vm,1nfrt5h,2025-09-13T10:38:24+00:00,ConoRiot,3,"Good season Suns.

Reckon Lions get a run on now.",0.4404,pos
ndz072o,1nfrt5h,2025-09-13T10:39:11+00:00,TheVision_13,3,Noble 2 touches 2 turnovers for 2 lions goals that’s the noble I knew and loved 😅,0.872,pos
ndz0skl,1nfrt5h,2025-09-13T10:44:36+00:00,LordGeoffVader,3,Brisbane out here playing FIFA,0.2023,pos
ndz0u6h,1nfrt5h,2025-09-13T10:44:59+00:00,NuuuDaBeast,3,"Lions Pies absolute cinema, Hawks Cats game of the decade",0.0,neu
ndz3q07,1nfrt5h,2025-09-13T11:09:58+00:00,bales1986,3,Brisbane are like a box of chocolates… you never know what you’re gonna get.,0.3612,pos
ndz4smk,1nfrt5h,2025-09-13T11:18:59+00:00,spurs-r-us,3,"Brisbane aren't even playing that well. Just applying level pressure and putting numbers in the right spot. The GC forwards aren't competing, the mids can't win a clearance, and the defence stands aside every team they enter 50 regardless of the quality of entry.",-0.521,neg
ndz52ym,1nfrt5h,2025-09-13T11:21:20+00:00,GreenOnions69,3,There's a bit of cope in this but I think leading Brisbane by 44 points and blowing it is better than this even though it's more heartbreaking.,-0.1505,neg
ndz62p1,1nfrt5h,2025-09-13T11:29:29+00:00,welcomefishies,3,I think Brisbane might just be better at football,0.4404,pos
ndz8u88,1nfrt5h,2025-09-13T11:50:51+00:00,Legitimate-Tip-7172,3,"This is exactly what we dished up against Brisbane 2 weeks ago, bomb it into the 50 just for Harris Andrew’s to mark every time",-0.4939,neg
ndz8vp7,1nfrt5h,2025-09-13T11:51:09+00:00,Croob2,3,"BRISBEHINDS FUCK OFF, I WANT BRISBANE BACK",-0.4939,neg
ndz93h1,1nfrt5h,2025-09-13T11:52:46+00:00,Phlanispo,3,Brisbane defenders can't let us have a single 1v1 contest inside 50. Poor sports.,-0.4215,neg
ndz9ftt,1nfrt5h,2025-09-13T11:55:15+00:00,NuuuDaBeast,3,"ball knowers knew this wouldn’t be close, respect Brisbane",0.4767,pos
ndz9wrh,1nfrt5h,2025-09-13T11:58:42+00:00,bombersbroncos,3,Thoughts on this this Brisbane team v Collingwood next week?,0.0,neu
ndzblus,1nfrt5h,2025-09-13T12:10:31+00:00,NuuuDaBeast,3,"Pies Lions will be closer than Hawks Cats. Cats genuinely spent half the year game planning for Brisbane that can’t be understated, I don’t think Collingwood can tag like that.",0.3612,pos
ndz10px,1nfrt5h,2025-09-13T10:46:35+00:00,Striking_Resist_6022,7,So it will indeed be Geelong v Hawthorn and Collingwood v Brisbane in the prelims. Pretty funny for a season that seemed to have so many potential underdog and new kid on the block stories that it’s gonna be one of the most boring combinations possible.,0.1548,pos
ndywulg,1nfrt5h,2025-09-13T10:08:01+00:00,Unfair_Yak8830,5,6-3 free kicks lions way. dare i say QLD bias?,0.4404,pos
ndylamg,1nfrt5h,2025-09-13T08:12:21+00:00,Korasuka,6,Come on Brisbane. Join your straight sets brothers. It's an elite club.,0.4767,pos
ndz02yq,1nfrt5h,2025-09-13T10:38:11+00:00,ratman573,5,anyone else sick of the ashcrofts yet? (brisbane fans banned from replying),-0.743,neg
ndys026,1nfrt5h,2025-09-13T09:20:15+00:00,limeIamb,4,Not the Lions being booed in a home final lmao,0.5994,pos
ndysbg8,1nfrt5h,2025-09-13T09:23:28+00:00,Intelligent-Trade118,4,"Food delivery placed✅

Drink poured✅

Let’s go, Lions",0.0,neu
ndyuqe4,1nfrt5h,2025-09-13T09:47:43+00:00,NuuuDaBeast,4,I love Lions footy when it’s not us,0.6369,pos
ndywddx,1nfrt5h,2025-09-13T10:03:26+00:00,STatters,4,Lions want to draw a high so bad,-0.6359,neg
ndyzm5a,1nfrt5h,2025-09-13T10:33:57+00:00,Ok-Eggplant4965,4,"I'm having fun and making new friends. So no matter what happens on the field I'm going home a winner.

That being said it would be very nice if the Brisbane Lions would honour my 20000 steps for the day (so far) with a nice soothing victory please.",0.9704,pos
ndz6l5p,1nfrt5h,2025-09-13T11:33:33+00:00,GreenOnions69,4,"Brisbane kick 4 behinds in the next 2 minutes to bring a 47 point lead into 3QT.  
Gold Coast kick 10 goals to 1 in the 4th to win by 7 points I think.",0.5859,pos
ndz8x4w,1nfrt5h,2025-09-13T11:51:27+00:00,___TheIllusiveMan___,3,YES BRISBANE! LET THE BRISBEHINDS FLOW THROUGH YOU,0.4574,pos
ndyr91u,1nfrt5h,2025-09-13T09:12:41+00:00,tsitsifan31,2,Ok but how sick would it be if the lions ran out to the song circle of life (naaaazemenyaaaa from the lion king),-0.5927,neg
ndyrk7u,1nfrt5h,2025-09-13T09:15:48+00:00,Richo1624,2,Eye of the Tiger for a Lions game is certainly a chose,0.34,pos
ndyspkd,1nfrt5h,2025-09-13T09:27:26+00:00,UncleJohnsonsparty,2,"Pumped for this, always had a soft spot for Brisbane since the 90s and would love to see the Suns fans get some joy!",0.8172,pos
ndysvww,1nfrt5h,2025-09-13T09:29:13+00:00,Crazyripps,2,Ah god brownie doing another lions game. Let the awful commentary begin.,-0.2263,neg
ndytmjk,1nfrt5h,2025-09-13T09:36:42+00:00,Desperate_Garlic2377,2,Commentator said that Brisbane played Freo last week?,0.34,pos
ndyuvx5,1nfrt5h,2025-09-13T09:49:12+00:00,a-da-m,2,Why are the commentators gaslighting us about the fact that Brisbane has always been a fast play on team. Am I missing something?,0.0516,pos
ndyv0c1,1nfrt5h,2025-09-13T09:50:25+00:00,Tall-Breakfast-6100,2,Hey so fagan knew Daniher was going to retire a year out. Why didn’t the lions go harder to secure a key forward last off season?,0.34,pos
ndyvcdl,1nfrt5h,2025-09-13T09:53:35+00:00,Mish_00,2,that was fast thinking by the lions,0.0,neu
ndywcl5,1nfrt5h,2025-09-13T10:03:13+00:00,yokobarron,2,I don’t see how Brisbane can kick a winning score tonight with this forward line.,0.5267,pos
ndyworr,1nfrt5h,2025-09-13T10:06:28+00:00,Decent_Fig_5218,2,Starcevich and Lohmann. One chrome dome at each end of the ground means Brisbane are perfectly balanced,0.6369,pos
ndyxb7i,1nfrt5h,2025-09-13T10:12:25+00:00,incessant_penguin,2,Nice first quarter. I’m enjoying Brisbane’s angular play. Suns seem to be bring their best but I wonder if they can maintain their direct and clean game play for the next 90mins when the lions are so well positioned.,0.949,pos
ndyxm4h,1nfrt5h,2025-09-13T10:15:17+00:00,Own-Arachnid-5285,2,"Insane work from Levi there, Lions should have capitalise, never mind, they do it now.",-0.4019,neg
ndyxuxm,1nfrt5h,2025-09-13T10:17:36+00:00,Perfect_Finance_510,2,Brisbane’s forward 50 looks so much less congested,0.0,neu
ndyz318,1nfrt5h,2025-09-13T10:29:01+00:00,jxp1111,2,Shaping up to be a good game this. I keep thinking Brisbane are going to break the game open and then the Suns hit back.,0.4404,pos
ndyz9g7,1nfrt5h,2025-09-13T10:30:41+00:00,bales1986,2,"
I don’t mind lions winning I guess, but there has to be some penance for allowing Youi to get their foot in the door with their cringe-ass AFL ads.",0.296,pos
ndz0twi,1nfrt5h,2025-09-13T10:44:55+00:00,trugzilla,2,I have it on good authority that Brisbane will kick the winning score,0.765,pos
ndz0wwf,1nfrt5h,2025-09-13T10:45:39+00:00,rinoa69,2,Runaway with it lions. Much better performance this week,0.4404,pos
ndz0xo8,1nfrt5h,2025-09-13T10:45:50+00:00,Pegendary,2,well i guess its a welcome surprise for the doomer brisbane fans that seemed convinced it was over for them,0.836,pos
ndz1dpi,1nfrt5h,2025-09-13T10:49:46+00:00,Croob2,2,"Come on Lions, 1 more half",0.0,neu
ndz1ze6,1nfrt5h,2025-09-13T10:55:02+00:00,acllive,2,"Got slow cooked beef burgers, beers and mates

Great night to cheer on my lions",0.8126,pos
ndz3g4r,1nfrt5h,2025-09-13T11:07:34+00:00,BigBoSS_Riot,2,"Their midfield looks so much better than last week. Brisbane +12 inside 50s and +8 clearances, so clearly winning the territory. Handily winning contested possessions and tackles too.",0.9328,pos
ndz3sd3,1nfrt5h,2025-09-13T11:10:32+00:00,SurePie7330,2,Pies would’ve preferred to play GC even though the Lions only have half a team,0.34,pos
ndz3tdn,1nfrt5h,2025-09-13T11:10:47+00:00,JWBWJ,2,We could of been the ones to get smashed by brisbane,0.0,neu
ndz3zrm,1nfrt5h,2025-09-13T11:12:16+00:00,Richo1624,2,"Question is, can lions beat Geelong next week

Edit: yep yep I’m dumb my bad chat",-0.5267,neg
ndz4vke,1nfrt5h,2025-09-13T11:19:39+00:00,greyhounds1992,2,Brisbane keeps going Annable will be going to GC,0.0,neu
ndz69og,1nfrt5h,2025-09-13T11:31:02+00:00,MrAndersson286,2,"If Brisbane win and someone does not blare Sink the Pink over the loudspeakers, well they should be sacked",0.7096,pos
ndz6c5g,1nfrt5h,2025-09-13T11:31:34+00:00,Perfect_Finance_510,2,"See you next week Brisbane, should be a good game and best of luck",0.8779,pos
ndz9zew,1nfrt5h,2025-09-13T11:59:13+00:00,OverQualifiedFailure,2,Oh for ffs Brisbane… kick a goal,-0.5859,neg
ndz9zue,1nfrt5h,2025-09-13T11:59:19+00:00,Arkrylik,2,Matt Rowell vs the Brisbane Lions,0.0,neu
ndza7y7,1nfrt5h,2025-09-13T12:00:56+00:00,PhaseChemical7673,2,One Lions bandwagon flair please,0.3182,pos
ndzc22e,1nfrt5h,2025-09-13T12:13:40+00:00,Croob2,2,Well done Brisbane!,0.3382,pos
ndzc270,1nfrt5h,2025-09-13T12:13:41+00:00,ultralord4000,2,So when do tickets go on sale for lions v pies,0.0,neu
ndzc4bq,1nfrt5h,2025-09-13T12:14:05+00:00,Legitimate-Tip-7172,2,Score is eerily similar to our game against Brisbane 3 weeks ago,0.0,neu
ndyyu1m,1nfrt5h,2025-09-13T10:26:40+00:00,D00rb1tch,7,Brisbane have been loving the freebies from the umpires this finals series ,0.7717,pos
ndywyhw,1nfrt5h,2025-09-13T10:09:03+00:00,Fearless-Big2406,4,"lol afl robbing the lions, that hit the post lol",0.6808,pos
ndyu7dc,1nfrt5h,2025-09-13T09:42:33+00:00,SUCK_MY_HAIRY_ANUS69,3,Lions? More like Lioffs,0.4201,pos
ndywnyg,1nfrt5h,2025-09-13T10:06:15+00:00,Forsaken-Scar-5002,2,love the suns coming of age story but rooting for Brisbane because Dan does footy will be insufferable if suns win,0.8316,pos
ndz01rq,1nfrt5h,2025-09-13T10:37:52+00:00,NuuuDaBeast,3,"games over Suns can’t protect a late lead especially against the comeback kings, and Lions are leading",0.3818,pos
ndz1tzk,1nfrt5h,2025-09-13T10:53:44+00:00,JorReno,4,"I want the Suns to come back, but sadly I think it's GG. Might be a bit of a late fightback, but I think it'll be too late.


I think Lions will torch the pies next week. And then they'll lose to Geelong by a goal or too.",-0.494,neg
ndzac6r,1nfrt5h,2025-09-13T12:01:46+00:00,Kappet,4,Brisbane always Gold Coast father 😘,0.0,neu
ndywln9,1nfrt5h,2025-09-13T10:05:38+00:00,ilovewoody699,4,"Browny should not be allowed to commentate lions games, cunts annoying as fuck",-0.8779,neg
ndys371,1nfrt5h,2025-09-13T09:21:08+00:00,Gullyhunter,2,"I hate this ""big brother/ little brother"" rhetoric. The lions are only like 15 years older than the suns.",-0.296,neg
ndz9n7o,1nfrt5h,2025-09-13T11:56:47+00:00,jrfoster01,3,Lions player just casually jogs towards the player and into the protected zone. Why are they not calling these obvious 50m penalties?,0.5574,pos
ndz0iw4,1nfrt5h,2025-09-13T10:42:11+00:00,CrzySpceMnky,3,Is it just me or are Brisbane getting a bit of a ride from the umps this quarter,0.0,neu
ndyqmiz,1nfrt5h,2025-09-13T09:06:16+00:00,NuuuDaBeast,2,Everyone is talking about the Lions being down and out when they dominated Hawthorn 3 weeks ago without Neale. They’ve done well despite their injuries and have had very dominant games with the current list they have fit. They have also responded after every loss this year,0.3182,pos
ndytkuy,1nfrt5h,2025-09-13T09:36:14+00:00,After_Effort_9141,2,"The annoying thing about losing to suns last week is knowing Lions are cooked and are gonna get beat comfortably. 

And then moving to a beatable Collingwood. ",-0.3612,neg
ndywxlm,1nfrt5h,2025-09-13T10:08:49+00:00,Croob2,2,I want Brisbane to win but I've caught myself cheering for GC a couple times already,0.7906,pos
ndyzpxw,1nfrt5h,2025-09-13T10:34:54+00:00,NuuuDaBeast,2,Lions beat Collingwood,0.0,neu
ndz0phb,1nfrt5h,2025-09-13T10:43:52+00:00,Lopsided_Safe4091,2,"geez, anything to let Brisbane win hey?",0.5859,pos
ndzcc7r,1nfrt5h,2025-09-13T12:15:38+00:00,AffectionateProof271,2,"Things you love to see!!!

We may have lost an elim, but getting to see this makes it better, thank you Brisbane 🧡",0.8728,pos
ndz9w3a,1nfrt5h,2025-09-13T11:58:34+00:00,Korasuka,2,Sack Brisbane.,0.0,neu
ndz4uzz,1nfrt5h,2025-09-13T11:19:31+00:00,IDreamofHeeney,2,"I cannot witness another Brisbane flag. Please Collingwood, beat them for me 🥹",0.3182,pos
ndymx8o,1nfrt5h,2025-09-13T08:28:52+00:00,PhaseChemical7673,1,Something tells me Lions win this… it’s probably everyone saying Suns have got a good chance that have pricked my ears,0.7964,pos
ndyrrgt,1nfrt5h,2025-09-13T09:17:49+00:00,shocking_red_4,1,"Gold Coast with their galah guernsey. 



Brisbane lions with their cowboy maroon.",0.0,neu
ndyrvs5,1nfrt5h,2025-09-13T09:19:03+00:00,acllive,1,Lions to kick to the vulture street end all game to improve Gabba accuracy,-0.0258,neu
ndyscl2,1nfrt5h,2025-09-13T09:23:47+00:00,lurkin_gewd,1,Toowoomba Lions,0.0,neu
ndyu8i1,1nfrt5h,2025-09-13T09:42:50+00:00,Legitimate-Tip-7172,1,Jeez there’s gotta be a lot of suns fans there that’s an audible boo on the lions fk,0.0,neu
ndyuxgv,1nfrt5h,2025-09-13T09:49:38+00:00,breaking-hope,1,BRISBANE ARE POREMIERS,0.0,neu
ndyxp5k,1nfrt5h,2025-09-13T10:16:05+00:00,Randomaf1234,1,Suns looking slow next to the lions,0.0,neu
ndyzsje,1nfrt5h,2025-09-13T10:35:34+00:00,canary_kirby,1,DIMMA:  TELL THE BOYS TO LIFT AND NO MORE GOALS FOR THE LIONS,-0.296,neg
ndz07ts,1nfrt5h,2025-09-13T10:39:23+00:00,jxp1111,1,"I feel like the Suns are broken now. I'm sure they won't give up, but Brisbane with a roll on are just too good for them. They are a team very much on the up though.",0.6369,pos
ndz0985,1nfrt5h,2025-09-13T10:39:44+00:00,Bobblefighterman,1,If this keeps going the only one on this Suns team to beat the Lions in a final will be Dimma.,0.0,neu
ndz0g37,1nfrt5h,2025-09-13T10:41:28+00:00,Gojirahawk,1,Suns should be relieved this Lions spark is happening close to half time .. just need to weather the storm,0.5423,pos
ndz2ph5,1nfrt5h,2025-09-13T11:01:18+00:00,Crosso221,1,"A Damien Hardwick coached side getting dominated in the first half in a final in Brisbane, I’ve seen this movie before",0.0,neu
ndz3otj,1nfrt5h,2025-09-13T11:09:40+00:00,___TheIllusiveMan___,1,Quick someone make this a charity match so Brisbane miss everything,0.3338,pos
ndz4pnn,1nfrt5h,2025-09-13T11:18:19+00:00,goatmarino,1,Well pies lions it is,0.2732,pos
ndza6zd,1nfrt5h,2025-09-13T12:00:44+00:00,Mega-Metagross,1,How are pies fans feeling facing lions in the prelim?,0.128,pos
ndz10p5,1nfrt5h,2025-09-13T10:46:35+00:00,Commercial-Oil-8905,1,Brisbane getting a ride from the umps,0.0,neu
