id,submission_id,created_datetime_utc,author,score,body,sent,label
nd1wnpp,1nb6kbp,2025-09-08T08:36:57+00:00,Feeling-Air-5109,1,"Yeah I do hope the lions win but I know they’re definitely won’t win when it comes to the suns this time because this is not the old suns this is the new suns and the new suns are going to beat the Lions this weekend on Saturday because we now have a really big advantage with a new coach and the lions losing a lot of they lost a lot of really good players and their coach is alright, but we definitely have a better coach now for the suns because our coach for the suns have went to the final went to the grand final and also beat the grand final and win so we definitely have a really huge advantage and we haven’t lost any of our good players this year so this is definitely a new start for the brand-new updated awesome amazing brand-new suns who are going to beat the Lions and win this weekend",0.9972,pos
nczu14h,1nb6kbp,2025-09-07T23:29:42+00:00,Bitchbettahavmahoney,7,Yeah there's generally one of the top 4 that lose in the first week and bounce back in the second week. I think that's more likely to be Adelaide than Brisbane right now.,0.0772,pos
nczsbjm,1nb6kbp,2025-09-07T23:20:16+00:00,rubixqube,13,"Yeah it happens every year because the top 4 teams lost their game and the bottom 4 teams won their game so people get caught up in that, when the reality is that more often than not the top 4 teams are still the better team. 

This year might be different given how close the top 8 has been all year, plus Brisbane having a massive injury list",0.7964,pos
nczyrl8,1nb6kbp,2025-09-07T23:57:18+00:00,God___frey-Jones,4,"I feel like straight sets are a bit more common these days, probably since the pre finals bye came in.

I think the Suns will beat Brisbane due to the Lions looking battered, but Hawthorn on a 6 day break in Adelaide are going to struggle",-0.1901,neg
nd1xs8r,1nb6kbp,2025-09-08T08:48:40+00:00,Feeling-Air-5109,1,Yeah but that’s just the way things are and the lions haven’t really had a very great year this year because of them losing a lot of their good players so we obviously know that the suns are going to win and beat the Lions because we have a way better coach now because our new suns coach has been to the finals have been to the grand finals and won the grand final so we definitely already know that we are going to beat the Lions so really it is still very possible for lions to beat us but they were just need a miracle because they’ve lost a lot of of their good players,0.9926,pos
nd0b05d,1nb6kbp,2025-09-08T01:09:55+00:00,Fruney21,6,Whenever the Lions lose they always look out of ideas. We have one game plan which works most of the time and then Pikachu face when it doesn’t,-0.4019,neg
nd1fspq,1nb6kbp,2025-09-08T05:51:14+00:00,MillionKarma23,4,"Hawks by 3. 

Brisbane by 45.",0.0,neu
nczmxuw,1nb6kbp,2025-09-07T22:50:52+00:00,ra-ra-rasputin-lover,9,Lions by 50 is wild,0.0,neu
nd0tl4j,1nb6kbp,2025-09-08T03:02:45+00:00,NachoLiberatore,3,"Not sure if I'm missing something, but what are you referring to when you say you lost on the Gold Coast each of the last 5 seasons?

In the last 9 seasons Brisbane have a 6-2 record against the Suns on the Gold Coast (no game in 2020). Only losses were 2023 and 2025.",-0.8216,neg
nd1u9a7,1nb6kbp,2025-09-08T08:11:53+00:00,Feeling-Air-5109,-1,So that doesn’t mean anything that was just luck Gold Coast have beaten the Lions this year and we have a very high advantage to win because we have the coach who has been in so many finals and who has been in the grand final and won plus lions have lost a lot of players because they were injured and they couldn’t play and they were forced to retire so it is very possible for the lions to win but they would need some sort of miracle to make it through because the Gold Coast suns have definitely proven. They are a lot more stronger than they’ve ever been before so I definitely would be very scared for the lions but hopefully there is some good sportsmanship and you guys don’t be too mad and congratulate the Gold Coast sun we beaten your team this weekend,0.969,pos
nd1umi8,1nb6kbp,2025-09-08T08:15:43+00:00,Feeling-Air-5109,-2,Exactly and no offence but it doesn’t really make sense when they said they play only good when they’re at the Gabba the Gabba doesn’t do anything to the players that is just luck suns have lost a lot of times to the Lions because we didn’t have a really good coach and people kept leaving that is why so they had a advantage but now we have the advantage and they don’t there’s the difference so really there is no luck. They just need a miracle now they can still win. It’s possible but they would need a miracle for it to happen.,0.9884,pos
nd1xkor,1nb6kbp,2025-09-08T08:46:29+00:00,Feeling-Air-5109,1,"Yeah, because we know that the Gold Coast Suns are going to beat the Lions because it’s obvious how well they’ve done this year and the lions have lost so many good players this year and now we have even a better coach than what we had in the last few years because our new coach for the suns have been to the finals and to the grand final and win the grand final so we definitely have a way bigger advantage this time and we haven’t lost any of our players this year. Everyone is still in the team still going strong and better than ever we’re definitely way more stronger than we’ve ever been before and definitely way stronger than the lions for sure since we beaten them already this year and we can always beat them again so I definitely know that it’s pretty obvious that we are definitely going to beat them again. I can’t wait. It’s gonna be so much fun and such a good game to watch. I can’t wait to see. Suns win once again. I’m so excited and even if we don’t win the grand final just being in the grand final will definitely be enough and it’s gonna be such a big achievement for them. I can’t wait to watch. Suns beat the Lions obviously and beat the other team in Melbourne next weekend. Coming up after this weekend is done and then hopefully we get to win the grand final",0.9976,pos
nd4eve4,1nb6kbp,2025-09-08T17:51:53+00:00,Feeling-Air-5109,0,And your team literally beaten the grand final so it is fair for another team like suns to be in the grand final and maybe even win it so you should be happy at least for the suns because they deserve it after not being able to get into the finals for 15 years since the suns became a thing so when suns definitely beat the Brisbane Lions this weekend it will be such a huge achievement for the suns so you should at least be happy for us and excited for the suns ,0.9779,pos
nd4axl2,1nb6kbp,2025-09-08T17:33:36+00:00,Feeling-Air-5109,1,"Yeah, but we already know that the Brisbane Lions and all of their good players are out for the season meaning that all they have left is some okay players who were not that good as the really good players who are all out because of them getting injured and not being able to play",0.9331,pos
nd4bdxi,1nb6kbp,2025-09-08T17:35:42+00:00,Feeling-Air-5109,1,But you’re also gonna have to try to beat the suns because everyone knows they are definitely going to beat Brisbane Lions and then we head to Melbourne after we beat the Brisbane Lions two beat Collingwood,0.5499,pos
nd1z0p7,1nb6kbp,2025-09-08T09:01:21+00:00,Feeling-Air-5109,1,"Yeah, but the Suns are definitely going to beat the Lions because they are in such a bad position at the moment so like it is very possible for them to win but the only way they can win is for a miracle to basically happen at this moment like the lions have lost so many really good players so I feel bad for them but even through the suns beat the Lions it is fair because the lions won last year in the grand final so they’ve already had their chance and they should at least be proud that they’ve made it to the finals this year  even through they are going to lose to the suns obviously and the suns will definitely beat the lions absolutely",0.992,pos
nd1zrqb,1nb6kbp,2025-09-08T09:09:04+00:00,Feeling-Air-5109,0,"Yeah, but you’re still going to lose so because you’re going through the same thing that suns  went through so many times because the suns have never made it to the grand finals or even to the finals but you have but the reason why we never went into the finals is because we’ve never had a good coach who had experience going into the finals winning the finals going into the grand final and winning the grand final and now we finally do and we used to have so many players who were injured who ended up leaving like Gary Ablett Tom Lynch and so many other players over the years and now we’re finally in a really good spot where we have a huge advantage against the lions because the Lions are now going through exactly what we went through they have so many injuries and so many of your players left throughout the year so at the moment you can still win but this time there is no luck and you’re definitely gonna need some sort of miracle but you should at least be proud of yourself making it this far even through this is your last time playing this year until next year but hey I’m so proud of all lions and how far they’ve come. They deserve a break.",0.9929,pos
nd24no2,1nb6kbp,2025-09-08T09:58:22+00:00,Silly_Cup7872,1,"Brother you could play the Cats at the Shanghai stadium next week and I still think you’d lose, did you seem then dismantle the lions?",-0.0772,neg
nczj29l,1nb68uv,2025-09-07T22:30:30+00:00,Red_je,115,"Suns, Brisbane, Adelaide in that order.

Geelong, begrudgingly if they are against the Pies or Hawks...

If the unthinkable happens and it is Pies v Hawks, guess I'll just pray for the end of days",0.3182,pos
nczp063,1nb68uv,2025-09-07T23:02:10+00:00,janesk91,6,"As a Sydney based eagles supporter and GWS member, I’m well versed in bandwagons. I’m now firmly on the Gold Coast train… and then Brisbane I guess?",0.4939,pos
nczf5hn,1nb68uv,2025-09-07T22:09:26+00:00,strangeMeursault2,40,"My order of preference would probably be:  
  
Gold Coast > Brisbane > Geelong > Collingwood > Hawthorn > Adelaide",0.0,neu
nczzmbl,1nb68uv,2025-09-08T00:02:21+00:00,DwarvenFreeballer,16,"1 Suns. Cute, cuddley and harmless. You just want to take them home with you.

2. Pies - they play the most entertaining football and I've always had a soft spot for them, especially Beau.

3. Hawks - love their high spirits and attacking play.

4. Geelong - Don't hate them.

5 Adelaide - low on the list due to their homophobic supporters.

6 Brisbane - I live in Brisbane but if they ever have more premierships than WCE, my friends will never stop giving me shit. Plus Zorko's a flog.",0.7766,pos
nczsebi,1nb68uv,2025-09-07T23:20:41+00:00,TheJoker__789,4,Geelong winning the flag will physically hurt me but I’d also be able to deal with it the easiest because it’d upset literally everyone. I wouldn’t mind seeing Lions fight back to go back to back.,-0.4767,neg
nczxp19,1nb68uv,2025-09-07T23:51:06+00:00,Itstheswanno,4,Brisbane or Adelaide,0.0,neu
nczik3s,1nb68uv,2025-09-07T22:27:51+00:00,Juicyy56,6,Suns - Hawks- Brisbane - None.,0.0,neu
nczsssc,1nb68uv,2025-09-07T23:22:53+00:00,Val367,9,"Suns for the fairytale ending to a first finals tilt.

Brisbane as they are one of my favourite teams.

Ugh, Adelaide would have been second if not for the last few weeks.

Geelong/Collingwood. Don't really like them but can respect the success they have had.

Hawks, mum always said if you don't have anything nice to say .......",0.6847,pos
nczhz94,1nb68uv,2025-09-07T22:24:46+00:00,RadicalBeam,4,Gold Coast  > Brisbane >>>>>>>>>> anyone else,0.0,neu
nczlaqu,1nb68uv,2025-09-07T22:42:05+00:00,blueeyedharry,13,"My arguments against other current teams: 

Adelaide: no need to comment. Like Adelaide when they do the wrong thing. 

Collingwood: recent flag and come on, you know they are going to be even bigger wanks if they win.

Geelong: as above. Do you really want this lot continuing to have success whilst your club flails miserably? 

Brisbane: recent flag and have taken diving to a new level, making our past dives look less bad. 

GC: Hardwick is a wanker, at least our wanker is honest, loves his wife, and is good to listen to in the media.

In conclusion, I expect we will have 0.1% neutral fans.",0.1245,pos
nczgc8s,1nb68uv,2025-09-07T22:16:02+00:00,Gydafud,11,Geelong > Gold Coast > Brisbane > Adelaide> Collingwood > Hawthorn,0.0,neu
nczmjgh,1nb68uv,2025-09-07T22:48:44+00:00,theogpragysahoo,4,"A non-Victorian team, preferably Adelaide, then the Suns. Brisbane won a premiership last year so they’re after the Victorian teams as far as I’m concerned.",0.5719,pos
nd0980s,1nb68uv,2025-09-08T00:59:26+00:00,Radiant_Cod8337,2,"I'm not. 

After deplorable umpiring decisions in the Brisbane v Geelong and Freo v Suns games tarnishing the contests, I'm done for the year.",0.1511,pos
nd14i3p,1nb68uv,2025-09-08T04:16:51+00:00,Sean_Stephens,2,"If Gold Coast beat Brisbane this week and then us next week, I wouldn't even be mad. Great to see them have some success.",0.8867,pos
nczki5t,1nb68uv,2025-09-07T22:37:57+00:00,Grolschisgood,5,"Crows, suns, cats, lions, pies, hawks for me.",0.0,neu
nd02shj,1nb68uv,2025-09-08T00:20:58+00:00,Chilli_Wil,3,"I barrack in reverse order of who I hate least. Of the remaining teams I’ll list the order that I don’t want them to win:

1. Collingwood
2. Geelong
3. Hawthorn
4. Brisbane
5. Adelaide
6. Gold Coast

So I’m currently hoping GC and Crom make it to the prelims, but if they both stumble I’m then hoping for a Brisbane vs Hawks GF, and so on.",0.7451,pos
nczgjff,1nb68uv,2025-09-07T22:17:06+00:00,Icanfallupstairs,2,Suns -> Brisbane -> Hawthorn -> Cats -> Pies -> Adelaide. Any other year and Crows would have been 2nd or 3rd.,0.0,neu
nd04zx0,1nb68uv,2025-09-08T00:34:09+00:00,chr0m,2,"Can't stand Dimma, so Suns are out, Hate Hawks and Collingwood for obvious reasons. So preference would be Brisbane, Adelaide, Geelong in that order",-0.5719,neg
nczprpt,1nb68uv,2025-09-07T23:06:15+00:00,Salzberger,1,Once we're knocked out by Saturday it'll be Brisbane or Gold Coast.,0.0,neu
nd07z3f,1nb68uv,2025-09-08T00:51:56+00:00,HomerJBagger,1,"Gold Coast all the way!

Then I guess Brisbane.

Then the end of Aussie Rules football forever.",0.0,neu
nd0lmi6,1nb68uv,2025-09-08T02:13:46+00:00,TheAntihero-HeroClub,1,"Anyone but Pies, Lions and Cats. Don’t dislike any of them but those three have hogged the finals series for too long now and I’d love to see someone else",0.5267,pos
nd0zynf,1nb68uv,2025-09-08T03:44:28+00:00,Created_By_InGen,1,"Suns, Crows, Lions",0.0,neu
nd12ltd,1nb68uv,2025-09-08T04:02:44+00:00,ONAImpulse,1,"If Roma is going we want the cats to do as poorly as possible.

Brisbane & Gold Coast finishing as high as possible helps to chew more picks with academy's etc. Particularly GC.

I have a bit of a soft spot for the Nepo Babies otherwise :p",0.5423,pos
nd15yf7,1nb68uv,2025-09-08T04:28:01+00:00,AussieGirl27,1,"I kinda wanted Freo so that Nat Fyfe could go out on a high but I really want the Suns to stick it to all the others.

Collingwood - abso-fucking-lutely not

Geelong - see above

Brisbane - I should say no seeing as how they bent us over and fucked us hard last year but I actually wouldn't hate it if they won

Crows - no because of the their homophobic fuckwit fans and how the club didn't ream them a new one

GWS - at no point in my life do I want to see that grub Toby Greene win anything, not even a meat tray

Hawks - nope, vomit

So GO SUNS!!!!!!!",0.6242,pos
nd1y2yn,1nb68uv,2025-09-08T08:51:46+00:00,Hari-Seldonn,1,Carn the suns!!! Or Brisbane!!,0.0,neu
nczz0ky,1nb68uv,2025-09-07T23:58:46+00:00,SteamMonkeyKing,1,"Definitely Brisbane, followed by the Suns and then based recently im putting all Victorian teams ahead of Adelaide. Ive always liked Brisbane for some reason.",0.6705,pos
nczutlq,1nb68uv,2025-09-07T23:34:15+00:00,mikkimikkiemikkiemoo,1,"Lions or Suns. 
But let's be real I think Geelong is making it.
I'll see myself out now 🤡",0.0,neu
nd03sxs,1nb68uv,2025-09-08T00:26:56+00:00,Anon_be_thy_name,1,"Suns then Lions then begrudgingly Collingwood.

I was favouring Adelaide over the Pies until all this shit started, now I want them to go out in straight sets so Rankine misses the first game next year.",-0.4457,neg
nczjtks,1nb68uv,2025-09-07T22:34:24+00:00,RetroDaddyMac,-1,"Always a Victorian team first, then ""underdog"", then classy culture = Geelong, Hawthorn, Collingwood, Gold Coast, Brisbane, Adelaide",0.4404,pos
nd05pev,1nb68uv,2025-09-08T00:38:29+00:00,ScallionAltruistic23,-3,"Not Adelaide after their defence of homophobia and the subsequent embrace by their fans of loud bigotry.

Never Hawthorn. Ever.

Not the diving Brisbane Lions featuring Cam Rayner.

Not the Gold Coast Academy.

Collingwood (besides Maynard and Cox) actually have some really likeable players, especially Sidebottom, Pendles, N Daicos and Moore.

Probably has to be Geelong though. Mainly because most of their players are really talented and humble and I've been a member for 25 years. :p",0.8948,pos
nczgxz9,1nb68uv,2025-09-07T22:19:16+00:00,tCowp,-4,"Suns, Geelong, Brisbane, Collingwood, Hawthorn, Adelaide


I'm pleased the teams I least like right now will knock eachother out, though one will make the finals",0.1999,pos
nd0md18,1nb68uv,2025-09-08T02:18:12+00:00,aa73gc,0,"Suns

Brisbane

Collingwood

Hawthorn

Geelong

Adelaide",0.0,neu
nd1dmhe,1nb68uv,2025-09-08T05:31:48+00:00,Lucky_Improvement888,0,"If Lions lose, then Suns. Then Geelong. Anyone but Collingwood….",-0.2144,neg
nczg34z,1nb68uv,2025-09-07T22:14:39+00:00,bigboystick,65,Rayner single handedly made me want Brisbane to go out in straight sets,0.296,pos
nd00c01,1nb68uv,2025-09-08T00:06:36+00:00,Vinnie_Vegas,0,"Come on, surely we're ahead of Adelaide (and Rankine) winning, and Brisbane (and Cam Rayner) winning.",0.8658,pos
nczq5wz,1nb68uv,2025-09-07T23:08:23+00:00,No-Bison-5397,18,"Love how the Crows and Lions have damaged the vicbias group think.

It will mean we can all hate together.",-0.34,neg
nczm9ei,1nb68uv,2025-09-07T22:47:14+00:00,Effective_Dropkick78,-24,"How is it that by the letter of the laws of the game, every fan, player, and official who is not connected to the Lions can be so wrong? Rayner was shoved in the back while he was taking a step forwards, so he was automatically off-balance; it was an off-the-ball prohibited contact, and done in plain sight of the umpire who had warned O'Connor less than a minute earlier.


I just don't get it. I must be taking crazy pills instead of my Diamox and Xarelto.",-0.7344,neg
nd028uk,1nb68uv,2025-09-08T00:17:48+00:00,Dear_Analysis682,5,"Any good will they had has been largely used up on the last 4 weeks. I dont even think its just about Rankines comments cow plenty of other players have said or done things and they just serve their suspension. The club and the AFL managed it poorly and then on Thursday their fans behaved incredibly poorly. Booing the target of a homophobic slur is disgusting behaviour and I know its not all of them but seeing so many people defend it has been beyond disappointing. I just cant support the club this year, I don't even care if its Collingwood or Geelong or Brisbane who have won a lot of finals. I would like Gold Coast to win their first but that is an outside chance. Anyone but the Crows at this stage.",0.7287,pos
nczr0ln,1nb68uv,2025-09-07T23:13:06+00:00,flibble24,11,"Nope. It's wider than that, flopping in sport is the Antichrist

Lions for straight sets please",0.4939,pos
nd0aezk,1nb68uv,2025-09-08T01:06:32+00:00,Rappa64,-3,"As is typically the case with anyone associated with the Mayblooms, you redefine intent to fit your narrative. You claim you jest but in doing so take cheap, targeted shots at all other finalists incl; calling Coll wankers, applying the same slur to the Suns coach whilst resorting to a sleazy shit take on his private life, trying to shame and blame Lions for adopting the similar ducking/diving tactics used by Haw and a weak pisstake of the low hanging fruit which Crows currently provide.

No anger or deep-seated fragility in my response, rather a relaxed but targeted return of serve with a post of similar intent to yours … some light hearted banter pointing out the deficiencies of other finals contenders … and your club comes up well short. 

You own the ‘snowflake’ tag here",-0.9628,neg
ncw687g,1nar22q,2025-09-07T12:21:53+00:00,Pleasant-Role1912,96,"Literally any footballer: Exists

Brisbane Lions:

https://preview.redd.it/jws0263njqnf1.jpeg?width=225&format=pjpg&auto=webp&s=245d6a8ecc3b6de5e3ae9f5aa0b0fcbb41fb07b3",0.0,neu
ncw1u75,1nar22q,2025-09-07T11:49:58+00:00,PerriX2390,22,"> and the Brisbane Lions

With our reported interest in Budarick, McGovern, and Ridley, probably means we'll be getting the Lester retirement announcement this week. Hopefully Starc chooses to remain at the Den.",0.6908,pos
ncw7kc7,1naqh7d,2025-09-07T12:31:07+00:00,matthew_anthony,134,"Let me make you feel better

Chris Fagan came and checked into my hotel once. I was the only person who was familiar with AFL. I saw on the arrivals that he was here and had been booked through the Lions, so freaked out. But I wanted to keep it cool and also be professional.

Anyway, he gets to the hotel and sure enough comes straight to me to check in. He goes “booking under Fagan”. I try and be cool and go “oh don’t worry, I know who you are are. Welcome Chris. How’s the pre season going” or something along those lines to make him feel welcome. 

Instead, I just go, in the most star struck, fan girl way “I KNOW WHO YOU AREEEEE”

He looked at me like an absolute weirdo. I wanted to die",0.84,pos
ncvynmg,1naq1oi,2025-09-07T11:24:06+00:00,dlanod,13,The best part of the Lions in 2017 and 2018 was the women's team. Turns out the easiest way to have someone follow AFLW is to have a good team while AFLM is balls (pun intended).,0.872,pos
ncvv7hw,1napz00,2025-09-07T10:53:52+00:00,aph1985,49,"That says, Hawks has never won at ENGIE




Also last few years, hawks has either beaten or drawn with premiers. 


2020:  Hawks vs Tigers, Hawks win by 32 points
2021: Hawks vs Demons draw (R18)
2022: Hawks vs Cats, Hawks win by 12 points
2023: Hawks vs Magpies, Hawks win by 32 points
2024: Hawks vs Lions, Hawks win by 25 points


2025, Hawks have beaten Collingwood, Adelaide. ",0.8226,pos
ncvjlt1,1nao5fc,2025-09-07T09:01:55+00:00,laughingnome2,11,"In the event that both teams preferred (home) guernsey results in a clash - with the AFL acting as adjudicator of such matters - it is the responsibility of the away team to change to a suitable guernsey.

Brisbane is the home team, they get dibs on their home guernsey.",0.0258,neu
ncvkkss,1nao5fc,2025-09-07T09:11:11+00:00,Fluid-Island-2018,2,It would be a clash for Gold Coast as Brisbane are the home team,0.0,neu
ncvthb2,1nao5fc,2025-09-07T10:37:46+00:00,Ok_Coach145,2,"Maybe a Broadbeach Cats guernsey, may give the Lions flashbacks.",0.0,neu
ncveysb,1nalzpq,2025-09-07T08:17:35+00:00,National_Treat_4079,10,"Feels a lot like when we got Gtrain and Hamill.... And had the kids like kozzi and roo coming through. If we had beat PA in the prelim, we would have smashed brisbane the next week. Bloody guerra missed that goal, and we lost momentum when G kicked the 100",-0.34,neg
ncvvq89,1nalzpq,2025-09-07T10:58:31+00:00,Sensitive-Housing495,1,"I don’t think so, maybe Brisbane fans after the rewoldt incident? ",0.0,neu
ncv80r3,1naluvy,2025-09-07T07:14:21+00:00,No_Childhood_7665,9,"To add to the ones already mentioned

The Merge - talks about the merger (or takeover from view of roy fans) between foundation VFL/AFL club fitzroy lions and expansion club brisbane bears 

The final quarter - timeline of adam goodes racism saga leading up to his retirement.",-0.6249,neg
ncv6sdc,1nakvp2,2025-09-07T07:03:27+00:00,Justabitbelowaverage,17,"I think subtle is the wrong word here.


Also lost the AFLW game to Brisbane by 3 points after they scored 3 goals to nil in the 4th quarter (38 : 41)


Feels like someone used a monkey paw at the club ",-0.4404,neg
ncuwtgp,1naktpg,2025-09-07T05:34:48+00:00,bmk14,13,"I agree. Brisbane's injuries and general fatigue will cause them to shit the bed next week. An unimpressive Suns will hobble over the line. 11.5.71 to 8.17.65.

Then the Suns have one more great game in the Prelim.",-0.0276,neu
ncvjhf7,1nak4ep,2025-09-07T09:00:45+00:00,,7,"The three things we will remember from this game 
1.Raynor flopping 2 times with a shit eating grin
2. Raynor waving the cheer squad after kicking a goal and being 30 odd points down
3. Brisbane being thoroughly blown the fuck out

Raynor has irreversibly tainted his brand all for a blow out final. Embarrassing",-0.7063,neg
ncuufxx,1nak4ep,2025-09-07T05:14:03+00:00,paulmp,18,"While I agree the first one was probably a dive, it was super soft at the very least... the second one was absolutely idiotic of Guthrie, he had to know the umpires were going to pay that second one.

The umpire literally yells to O'Connor ""I warned you about that"" as he pays the free, which makes Guthrie's action so incredibly dumb.

I do find it funny that Geelong fans are so up in arms about it when they had several players that built entire careers diving, dropping knees and throwing arms up to get high frees... and they defend them as champions of the game (they are right, Selwood and Hawkins were champion players, but Selwood literally said he made a career out of ducking)

Downvote away Geelong supporters. At least I don't see many Lions fans defending Cam, we've pretty much all said he dived on the first one, despite the contact absolutely being there.",0.9219,pos
