id,submission_id,created_datetime_utc,author,score,body,sent,label
ne4npig,1ngkj3h,2025-09-14T07:14:09+00:00,burnerphonelol,21,I think colours and mascot wise Brisbane has to be Gryffindor,0.4767,pos
ne4tslo,1ngkj3h,2025-09-14T08:11:32+00:00,Maximumlnsanity,8,Brisbane are trending towards Slytherin too,0.0,neu
ne9u9rd,1ngkj3h,2025-09-15T01:30:08+00:00,No-Bison-5397,1,Also true but Brisbane have been a top level team longer than the Tigers were at this point.,0.4767,pos
ne5037b,1ngjwgn,2025-09-14T09:12:05+00:00,Cyclonechaser2908,1,I was under the impression that Brisbane was a good side,0.5859,pos
ne4d7xg,1ngiq9c,2025-09-14T05:41:12+00:00,Mrchikkin,139,"Queensland follow winners. If the Lions drop off it's going to hurt footy there a lot more than if Port and Adelaide dropped off at the same time, for example.",-0.34,neg
ne4bjq9,1ngiq9c,2025-09-14T05:26:27+00:00,matthew_anthony,98,"Queenslanders are notoriously a fickle bunch

In a state dominated by NRL, the AFL only gets coverage when the Lions do well, and as such, not as many people buy tickets and support

And it’s not just AFL. The Broncos get significantly less support when they’re bad, Reds were selling out games until they became shit. Heat used to pack the Gabba and now they don’t",-0.1531,neg
ne4ofg1,1ngiq9c,2025-09-14T07:20:56+00:00,PRo_MoE1144,21,"I lived in QLD for a couple of years and my observations were that: Closer to the Brisbane CBD you get, the more AFL is is being played and followed.  It even felt like i saw more Sherrin's then Steedens being kicked around by kids in the inner suburbs of Bris.  Further from CBD (Country towns, Ipswich, Toowoomba, so on) less AFL, more Rugby L/U.  Gold Coast has a strong isolated hub of AFL too with heaps of Melb ex-pats.",0.7096,pos
ne5619n,1ngiq9c,2025-09-14T10:11:47+00:00,acllive,5,Nothing wrong with liking both NRL and AFL both are awesome sports and it means that if my lions turn it shit I still have the storm who are basically going to be in a prelim under Bellamy so it’s a win win for me,0.8736,pos
ne5ayex,1ngiq9c,2025-09-14T10:58:07+00:00,KHsonicdude23,5,"As a Brisbane resident, AFL definitely has a following here but it's not exactly engrained into the culture. It's a nice alternative to the NRL and there's plenty of people who follow both codes, but it definitely coexists with the former up here as opposed to down south.",0.8442,pos
ne4k79c,1ngiq9c,2025-09-14T06:42:14+00:00,nuffiealert,28,"No one gives a shit except NRL hardcore fans who can feel it encroaching on their patch. AFL will continually grow over time and will get to a point where it is on par in the south east of the state. The junior growth is so strong that the NRL can’t compete. It’s not a contest and there is plenty of room to enjoy both codes. I find most people I talk to are very aware of the Lions and have an interest. They might not watch the games, but many aren’t watching the NRL either. 

From my anecdotal experience, I think NRL isn’t really growing at all. It stays at its same level. While AFL is growing every year. We will see how that eventuates over the next 10-20 years.  The new Olympic stadium will massively grow the Lions base of active supporters who can easily get tickets and get to games with good public transport once the Cross River Rail opens.",0.9706,pos
ne4xuc8,1ngiq9c,2025-09-14T08:49:59+00:00,HotBabyBatter,1,"I’ve been following afl (and the lions) since 2018.  The one thing that’s sucks now is that all the games are late at night, so I can’t take my kids easily…cause I live 1.5 hrs away as is…

Annoying, but it is what it is. I’ll be back there when the crowds dry up.",-0.3818,neg
ne4szo4,1ngiq9c,2025-09-14T08:04:01+00:00,QuarterFooty,1,"I'm not sure if thats the case, Queensland has always been a Rugby League stronghold, they have 3 clubs in the NRL in the Brisbane Broncos, Gold Coast Titans & the Dolphins from Redcliffe. But nevertheless I reckon Australian Rules Footy is starting to pick up some steam up in QLD thats for sure.",-0.3968,neg
ne4tl5p,1ngiq9c,2025-09-14T08:09:39+00:00,brandonjslippingaway,1,"The soft underbelly for both codes is probably Qld and WA respectively. Remember, they basically flipped in the 1880s, though this is often forgotten about.

But I think a strong NRL club in Perth and strong AFL club in Brisbane and S/E QLD can maie faster inroads than in Sydney or Melbourne.",0.8674,pos
ne4ijr6,1ngiq9c,2025-09-14T06:27:25+00:00,LazyTitan1990bc,20,"Hate it say it but I agree. There’s definitely exceptions like with my family who have been on the lions wagon since the bears days, and have seen the shitty, the great, the shitty and the great again. For the vast majority though it is true. A girl at work the other day heard myself and another guy talking about AFL and walked over and asked us about it and didn’t seem interested in it until I mentioned the lions are doing well this year and won it last year. She then bought some lions merch only because she heard they were doing well.",0.9814,pos
ne4vw1u,1ngiq9c,2025-09-14T08:31:00+00:00,Thannoy,23,"QLD like winners - but if you win enough, you will convert some of those bandwagoners to actual fans. I can guarantee you some of members for Lions didnt start out as diehards...",0.8885,pos
ne4c72k,1ngiq9c,2025-09-14T05:32:09+00:00,nugeythefloozey,48,The Roar were bigger than the Lions for a moment in the 2010s too. Queenslanders just love winning!,0.8356,pos
ne4r9g4,1ngiq9c,2025-09-14T07:47:50+00:00,Big-Rain-9388,11,"Disagree about Queenslanders being fair weather with the NRL and want to know where you heard this

Broncos consistently get the highest average attendance in the NRL and break membership records every year

Dolphins have existed for less than 5 years and still get higher attendance and memberships than most Sydney based teams

Cowboys might not have as high attendance but have many loyal fans who are willing to drive in from Cairns and Mackay for home games

Despite the Titans never having a successful year in their existence, they still have a very vocal and passionate fanbase

This is without mentioning the state of origin matches that sell out in Brisbane every year, as well as filling the Caxton shoulder to shoulder with Maroon jerseys",0.8266,pos
ne4ufi5,1ngiq9c,2025-09-14T08:17:28+00:00,Ardeo43,4,A decade ago when the Lions were bad they were a very clear last in attendance other than the new expansion teams. It’ll be interesting how severe the drop off in attendance will be when the Lions aren’t contenders any more.,-0.3832,neg
ne6xe8b,1ngiq9c,2025-09-14T16:38:19+00:00,uncleandata147,9,"Absolutely this, it's ok to say Brisbane is growing as an AFL town, but QLD is not becoming an AFL state.",0.269,pos
ne89an0,1ngiq9c,2025-09-14T20:17:25+00:00,Ok-Baseball-5535,1,"We're not giving up Noosa.  It's our poshest beach filled with nice cafes and filled with wanke........  Oh ok I see it now.  You can have it.


Unfortunately after the NZ Warriors were given the Gold Coast that leaves native Brisbane beach lovers stuck going to Straddie.",0.4523,pos
ne5l0qq,1ngiq9c,2025-09-14T12:17:47+00:00,Green_Aide_9329,4,"Haha is your family mine? Because we were members of the Bears from the beginning, went to the home games, taking that long drive down the highway. My ex-husband was from NSW originally, so didn't follow. Even though my kids weren't born in Brisbane, they've been members of both AFL and AFLW from birth. The Lions and AFL in general is our family religion.",0.4588,pos
ne4zr5h,1ngiq9c,2025-09-14T09:08:42+00:00,Foodworksurunga,8,Tbf I did get sucked in as a kid thinking the Lions were a successful team as a kid. I rode out all the bad years though and that's what made 2024 so special for me. That will always mean a hell of a lot more to me than the threepeat.,-0.5871,neg
neag8kj,1ngiq9c,2025-09-15T03:50:32+00:00,MasterSpliffBlaster,1,"Considering the NRL Magic Round has always been in Brisbane I'm not surprised

Typical Victorian still can't tell the difference between the NRL and Super Rugby",0.4997,pos
ne4fkvm,1nghzjl,2025-09-14T06:01:24+00:00,Bright_Bell_1301,0,"I take your point but it would be a stronger point if, for example, they met Brisbane in the GF and the Lions had gone through finals undefeated to that point. But yeah, it's a no-brainer that bias is baked in to the system favouring all teams that use the MCG as their home ground. Any attempt to argue against this is moronic.",-0.1531,neg
ne4o2c6,1nghzjl,2025-09-14T07:17:31+00:00,Bright_Bell_1301,-19,"Weird take. They finished 8th. In an equitable system, they wouldn't be playing any finals at their home ground except when they are lucky enough to play against teams that share their home ground. Geelong don't share their home ground. And neither do the Lions, if they win through.",0.8781,pos
ne54iln,1nghzjl,2025-09-14T09:56:39+00:00,Propaslader,5,"2001: **Brisbane** vs *Essendon*

2002: **Brisbane** vs *Collingwood*

2003: **Brisbane** vs *Collingwood*

2009: **Geelong** vs *St. Kilda*

2011: **Geelong** vs *Collingwood*

2012: **Sydney** vs *Hawthorn*

2018: **West Coast** vs *Collingwood*

2020: **Richmond** vs *Geelong* @ Gabba

2021: **Melbourne** vs *Western Bulldogs* @ Optus

These are all the interstate (and Geelong) teams who have won the grand final against a Melbourne based club since 2000. I've included 2020 and 2021 as all Vic teams played finals interstate. 

It seems there are enough examples in the past 25 seasons to suggest that it isn't ""the most one sided advantage/disadvantage"" in sports history. It appears it just depends on how good the team is and how well they match up to their opponents, regardless of where it's played",0.9382,pos
ne5rbj1,1nghzjl,2025-09-14T12:59:48+00:00,80Z0,1,"It depends what you think is fair. Geelong Football Club don't want a final at Geelong unless there are three other finals in Melbourne and their opponent is non -Victorian and not as a tactical advantage for the team  but as an advantage to local supporters for when the stars align. They want as many Geelong supporters to watch as possible and that would be 40k at the MCG but 20k at Geelong if it was between Geel v Coll. That is why Chris Scott requests all home games in Geelong  during h&a but dismisses any questions about finals as it isn't beneficial to the supporters and doesn't provide much tactical benefit to the team (travelling to the MCG to watch is considered better than not getting a ticket).

Is your idea of fairness that Collingwood should be able to request to play our final against Brisbane at Adelaide Oval? That is the ground we play best and it would shoot Brisbane in the foot twice as they miss out on a game at the MCG.

The real equity issue is should the AFL lose revenue to allow teams to play at smaller stadiums when most of the home ground advantage is lost because both clubs' members have equal access to tickets? Should West Coast, Adelaide, Freo etc. get taxed more because one club wanted 45,000 spectators rather than 100,000 spectators at a final?",0.9698,pos
ne54c8i,1nghzjl,2025-09-14T09:54:53+00:00,kyrant,4,"Now you're being obtuse. Geelong have hosted home games and finals there for decades.

As recent as last week against Brisbane.",0.0,neu
ne4m2ug,1nghvoc,2025-09-14T06:59:06+00:00,Indian_Sweets,8,"I love this club 💙🤍 
Gg Lions!",0.7712,pos
ne4ivxz,1nghvoc,2025-09-14T06:30:28+00:00,International_Car586,6,Brisbane have found their Bougeyman.,0.0,neu
ne4516j,1nghvoc,2025-09-14T04:32:34+00:00,TomRed89,6,Nervous about this one. The GF rematch in the past 5 seasons have been the runner-up getting the chockies. I also think morale is high among Brisbane FC as a whole.,-0.2732,neg
ne4lw9d,1nghvoc,2025-09-14T06:57:28+00:00,JamalAli8,6,ggs lions!,0.0,neu
ne4dgvr,1nghvoc,2025-09-14T05:43:21+00:00,DJHitchcock,3,"I liked it better when North were good, but not Adelaide/Brisbane/Melbourne good. Now they’ve found their own level.",0.8248,pos
ne4lxxk,1nghvo6,2025-09-14T06:57:52+00:00,Waylander-arc,3,"We’re probably behind Melbourne/Brisbane and obviously North but damn can we still have some great games. Will still be an enjoyable season to watch.  

Marinoff’s stats week in and out can only be described as *disgusting*. ",0.7876,pos
ne43yvw,1nghit7,2025-09-14T04:24:12+00:00,legally_blond,36,"*checks last Collingwood-Lions match up*  

Unsubscribe",0.0,neu
ne4qagu,1nghmwk,2025-09-14T07:38:30+00:00,mokachill,8,"I don't remember if Simmo weighed in at the time but i can promise you Oscar didn't get off lightly as far as public and media scrutiny is concerned in WA. Bloke took a week off as mental health leave and as far as i know is still off social media.

Plus the situation is a little different, Oscar is a free agent who wanted to stay but wanted the security of a longer/better contract more, if we were willing to match what Brisbane offered he'd have gladly stayed. Compared to Zach who is under contact and (from what's being reported anyway) is pretty intent on leaving no matter what it isn't exactly a 1:1 comparison.",0.9428,pos
ne4nit2,1nghmwk,2025-09-14T07:12:22+00:00,ShadyBiz,4,"This is a bit reductionist, Allen also wanted a long term contract when he hasn’t been on the park for the last 2 years. If Brisbane were happy to offer him that and we got a pick for it, then it’s a win win.",0.9062,pos
ne4edpr,1nghmwk,2025-09-14T05:51:01+00:00,Pretend-Device-91,10,"You’re welcome , up the fucken lions",0.4588,pos
ne46xcr,1nghe5z,2025-09-14T04:47:22+00:00,Injaqenwetrust,36,"I'm hoping that Brisbane make it and win it. 

They'll have a big couple of days at Crown with their trophy but then they will go to the airport and take it somewhere that I won't have to hear about for the entire summer.",0.5106,pos
ne4ofki,1nghe5z,2025-09-14T07:20:57+00:00,Intelligent-Trade118,18,"I’d like the winner of Lions vs. Pies to win it all, no preference on their GF opponent. Say what you will, but I really like the way a lot of the Pies players play the game, so if it’s not us, I’d like to see them win it.",0.9625,pos
ne432tj,1nghe5z,2025-09-14T04:17:17+00:00,Vaas_Deferens,34,Brisbane vs. Geelong with the Lions winning by 118 points,0.5267,pos
ne41tea,1nghe5z,2025-09-14T04:07:47+00:00,MillionKarma23,12,Geelong Brisbane,0.0,neu
ne41wgh,1nghe5z,2025-09-14T04:08:26+00:00,Bergasms,63,"Geelong Brisbane via the following rigorous process of elimination.   

Hawks: zero redeeming features.    
Pies: zero redeeming features.    
Geelong: Brad Close.    
Brisbane: Not Collingwood.",-0.2732,neg
ne43yp3,1nghe5z,2025-09-14T04:24:09+00:00,Massander,19,"Brisbane v Hawks, if I was a neutral

Somehow little old Hawthorn, a club starved of success, is the underdog in this final series having come from 8th and in their first Prelim in 10 years. If I were a neutral I’d be backing them.

From a narrative standpoint I think Fagan facing his old club is the best GF option. Also an unlikely bulky hero",0.8402,pos
ne50h2g,1nghe5z,2025-09-14T09:16:00+00:00,a-da-m,5,Brisbane making the granny is a disaster because they are no hope vs Geelong.,-0.5267,neg
ne4fryq,1nghe5z,2025-09-14T06:03:08+00:00,Ok_Craft_2716,5,Brisbane vs Geelong,0.0,neu
ne4bwzl,1nghe5z,2025-09-14T05:29:39+00:00,Murraj1966,13,"Collingwood v Hawks

Brisbane in 3 consecutive Grand Finals is a snooze, Collingwood usually leads to a decent Grand Final and fuck Geelong",0.3612,pos
ne48g9o,1nghe5z,2025-09-14T04:59:59+00:00,DozzaTheDestroyer_10,3,Lions v Hawks.,0.0,neu
ne4r29f,1nghe5z,2025-09-14T07:45:55+00:00,horriblyefficient,3,"putting aside my team loyalty for a minute I don't really think any of those matchups would be a bad game. if any other team was the #8 seed and in hawthorn's position I'd be happy to see them in the GF since they're an underdog but it's *hawthorn*, fuck hawthorn


I'd rather play a worn out brisbane than a more rested collingwood so I guess I'm in favour of geelong vs brisbane",0.1901,pos
ne43g2c,1nghe5z,2025-09-14T04:20:08+00:00,storm13emily,5,"Geelong vs Collingwood 

Collingwood vs Hawthorn

Brisbane vs Hawthorn 

Geelong vs Brisbane",0.0,neu
ne46n9k,1nghe5z,2025-09-14T04:45:10+00:00,djpiratecat,4,"Hawthorn v Collingwood

Obviously I want to see the Hawks get in, and for the sake of the occasion it would be incredible to see these two clubs in a Grand Final for the first time ever. Hawks v Lions would also be a first time GF matchup so that'd be cool too, but the rare opportunity to see two powerhouse Melbourne clubs facing off is pretty tantalising.",0.8986,pos
ne5p4sz,1nghe5z,2025-09-14T12:45:39+00:00,Bright_Bell_1301,1,Brisbane v Hawks with the Lions shitting on them,-0.4215,neg
ne89a46,1nghe5z,2025-09-14T20:17:21+00:00,Defy19,1,"Hawthorn v Collingwood will have the best atmosphere on the day. As a neutral I’m hoping for that! 

Geelong v Brisbane would be the worst result",0.4926,pos
ne8fvyn,1nghe5z,2025-09-14T20:47:55+00:00,tehnoodnub,1,"In order of preference:

1. Pies v Hawks

2. Pies v Cats

3. Lions v Hawks

4. Lions v Cats",0.0,neu
nebkupa,1nghe5z,2025-09-15T10:14:52+00:00,yeahbroyeahbro,1,Hawks and Brisbane would be 🤌,0.0,neu
nei56fg,1nghe5z,2025-09-16T11:03:05+00:00,lazygl,1,"Yep this, don't mind the Lions players they seem like a pretty likeable bunch and Fagan is class.",0.872,pos
ne42q6e,1nghe5z,2025-09-14T04:14:38+00:00,Boatster_McBoat,15,"I am leaning Hawks Brisbane

The one redeeming feature I see in Hawks over Geelong is another getting beaten by #8 will somewhat paint over what happened on Friday night.

My logic maps to yours on Pies vs Lions",-0.4215,neg
ne5px2o,1nghe5z,2025-09-14T12:50:44+00:00,roarmetrics,4,"Not sure why you say that. Sure they played poorly in the qualifying final, but Lions beat them solidly twice this year. So I don’t think you can say they’re “no hope”",0.2189,pos
ne45fjw,1ngh93l,2025-09-14T04:35:45+00:00,butter-muffins,90,"You could technically take Brisbane out and it still works. Obviously understand why we are on these lists with our three peat and the last seven years but we made one finals in fifteen years between the two periods and were easily beat in the semis.

Geelong and Collingwood really carry the list.",0.4767,pos
ne45a64,1ngh93l,2025-09-14T04:34:33+00:00,Shadormy,36,"Replacing the Lions with the Swans or Eagles would get you back until 2000 (Dees/North and Dons/Blues). 

Replacing the Lions with the Swans and adding North would get you back until 1993 (Dons/Crows, last year there was only 1 Prelim).",0.0,neu
ne45frq,1ngh93l,2025-09-14T04:35:47+00:00,voidedexe,13,"the worst part is, you can take Brisbane out of this stat and its still true. one or more of Cats, Hawks, Pies in the last 19 final fours",-0.3182,neg
ne51e3k,1ngh93l,2025-09-14T09:25:23+00:00,doshajudgement,9,"people using threepeat brisbane in arguments feels disingenuous to me cause, unlike the other three teams who each had one or no bad years, you fully bottomed out and had to rebuild slowly like youre meant to

if it were port adelaide instead of you guys this year it'd basically be the same statistic too, like",-0.5267,neg
ne5oz33,1ngh93l,2025-09-14T12:44:37+00:00,pedleyr,4,">if it were port adelaide instead of you guys this year it'd basically be the same statistic too, like

It could be North Melbourne, Essendon or University and it'd still be the exact same statistic.

Not at all to take away from how good Brisbane are today and the last handful of years, but it's been the other three teams that have been consistently excellent for all of the last 20 years, not really so much Brisbane.",0.8294,pos
ne4tms1,1ngh8oy,2025-09-14T08:10:04+00:00,kazoodude,-2,"From what i've gathered the leaks/stories from Merrett's side are 1. the meeting with Hawthorn being leaked. 2. Petoro providing direct quotes to media about Merrett's reasons for assessing his options 3. Leaking that he may not attend the BnF, it isn't stated if that's Merrett not wanting to go, or not being welcome.

Essendon has had players and coach publically disappointed in him. Other snr Essendon people upset with him and commenting on Mitchell as if he's done something wrong.

I guess some people are just too traditionalist about these things that think an employer is like a wife.

To me it doesn't matter if you are a captain, CEO, first year player, coach, massage thearapist, reception ,account or sales manager. There is nothing wrong with going for a job interview or talking to a recruiter, and there is nothing wrong with recruiting staff to your organisation.

The employee needs to do what's best for them and the recruiters need to do what's best for their organisation.

Edit: Oh and Petoro is also Brad Scott's manager. And Brad Scott walked out on Hawthorn to join Brisbane too so maybe he should think about his own commitments.",-0.6433,neg
ne3xrx5,1nggopf,2025-09-14T03:38:29+00:00,2pl8isastandard,14,Brisbane going to be a force for the next era,0.0,neu
ne3xsxq,1nggopf,2025-09-14T03:38:41+00:00,Bourkey_94,27,"Unearthed a real gem here, lions going to be competing for a long time with the amount of young kids we have in the team.",0.0,neu
ne4bmo9,1ngfnoh,2025-09-14T05:27:11+00:00,DVolition77,2,"Just making the finals. And not seriously looking in danger of winning any. But that’s not really the thing anyway - we are just not competitive and with Brisbane, the Crows and North to come in the next 4 rounds this season is shaping up to be  a serious reversal of trajectory and there’s little joy to be found. I love AFLW and our team but the reality is no AFL coach would survive this.",0.8313,pos
ne5i4du,1ngfnoh,2025-09-14T11:56:55+00:00,GreenOnions69,1,It's a bit like going up to a West Coast or North Melbourne fan after round 3 2023 and telling them that Brisbane are actually the worst team because they've gone 0-3.,-0.0772,neg
ne5jbvw,1ngfnoh,2025-09-14T12:05:43+00:00,DangerousRoy,1,Round 5 is close to half the season and yeah if West Coast beat one of the teams that beat Brisbane you’d definitely be considering that.,0.5994,pos
ne43xgy,1ngfnod,2025-09-14T04:23:53+00:00,GreenOnions69,2,We're currently looking at 2 favourites winning from 6 games and wouldn't be shocked to see Brisbane and West Coast continue the trend (though West Coast should probably be favourites tbf),0.6555,pos
ne3mv6h,1ngf5r0,2025-09-14T02:25:38+00:00,PunsGermsAndSteel,247,At Lions training they should get Dunkley to try to tackle Rayner. Unstoppable force versus immovable object. Hook them up to a generator and solve the world's energy crisis.,-0.4588,neg
ne3swjd,1ngf5r0,2025-09-14T03:05:14+00:00,Doc323467,27,"He's an absolute machine, I still think he's highly underrated by most. 

His stats aren't spectacular or anything, but there's very few better in the game in that mid-size forward role who can push through the midfield. I think because Brisbane's midfield is so stacked, and he doesn't get big midfield minutes, people overlook him, but he's a great player, and I think with a higher usage role, he'd be talked up as a top 25-30 player in the comp.",0.9204,pos
ne3pkuu,1ngf5r0,2025-09-14T02:43:24+00:00,118765,8,"He is such a weapon for Brisbane, he can go in the midfield and do damage. In the forward line he is unstoppable, wonderful forward craft. He is the type of player that can kick 4 goals and win you a game. Well done to Brisbane last night as well, I think they can still challenge Collingwood.",0.7003,pos
ne4yisg,1ngf5r0,2025-09-14T08:56:35+00:00,Candr112,1,"Rayner is such a hard number one pick to read

On talent he’s definitely there, and when he plays well he’s so good, and then randomly he will disappear.

I think he’s perfect on the Lions who can cover his weaknesses and allow him to just have his moments where he can be a game winner.",0.9493,pos
ne3rtd8,1ngf5r0,2025-09-14T02:57:59+00:00,HeismanTheismann,6,"Just curious, does he frustrate lions fans a bit, not trying to start the whole “he is a diver” thing. 
But I feel like he can do this type of shit every week but doesn’t. Idk maybe I just haven’t watched enough of Brisbane but I feel like this guy could of been anything",-0.09,neg
ne4aetp,1ngf5r0,2025-09-14T05:16:43+00:00,FireStoneFlame,-1,"Oh Brisbane, don’t be so hyper sensitive. We still love everything about you champ(s).",0.6369,pos
ne3ez8v,1ngdhfq,2025-09-14T01:35:30+00:00,DozzaTheDestroyer_10,4,"Welcome, man. If you're looking for ongoing success, I recommend supporting Collingwood, Geelong, or Brisbane. If you're looking for upcoming success in the next few years, I recommend following Gold Coast, Gws, St Kilda, Richmond, or Hawthorn. If you're looking for just a casual team that isn't too flashy but not too trash, I recommend following Fremantle, Port Adelaide, Bulldogs, Sydney, or Adelaide. If you're looking for constant disappointment, follow Carlton. Hopes this helps.",0.9437,pos
ne9lugx,1ngdhfq,2025-09-15T00:39:52+00:00,btcsxj,1,"American here… jumped on the Lions bandwagon when we moved to Brisbane in 2023. Good timing as they’ve had some great seasons and it’s been a blast to watch. 

Collingwood remind me of the Raiders. Everyone hates them, but their fans are rabid. Like maybe actually rabid.",0.7003,pos
ne3ged3,1ngdhfq,2025-09-14T01:44:29+00:00,muzumiiro,1,Maybe it’s just in Brisbane but I think Geelong are also pretty universally disliked? Agree Swans and Tiges are more neutral.,0.6124,pos
ne3m765,1ngdhfq,2025-09-14T02:21:14+00:00,nuffiealert,2,I think most Lions fans hate the Cats more than the Pies. I know I do that’s for sure.,-0.3947,neg
ne3bro0,1ngdhfq,2025-09-14T01:15:25+00:00,blerghburger,5,Brisbane were the Bears before they merged with Fitzroy - gonna be the closest you'll get,0.0,neu
