id,author,score,created_utc,body
ne9jn2m,JRicho_Sauce,129,1757895981.0,Pretty confident it’s random from waiting room to queue. Everyone in the waiting room is just jumbled up.
ne9o6cn,woka,49,1757897630.0,"Wait until you try and pay and you get a gateway error when it tries to authenticate your card, then you get timed out and have to re-enter the queue. 🙃

One positive of the straight sets is that I don’t have to try and buy tickets again."
nea2ks1,Swimming-Session8806,21,1757902810.0,"MCC are to blame for this.  

Prelim(s) should be a ballot for Members, especially in an era where it's possible to have one or none at the G."
ne9trev,Specialist_Current98,11,1757899628.0,"A couple months ago, my brother, dad and myself were all trying to get tickets to go see hiltop hoods. I got my laptop setup on the website like half hour before, my dad did 15 minutes before and my brother only like a minute before. My brother got like 15th in the queue while my dad and I were both 5000+ in queue. Just a weird system."
ne9qnp5,AlexJokerHAL,15,1757898514.0,MCC - Oh well. Guess you have to go line up at 5am instead.
ne9sh36,nuffiealert,15,1757899164.0,"It’s not a first in system. That’s unfair. It’s random. As long as you pay full price membership to get a chance at tickets, then you have the same chance as everyone else for finals."
nea0sjl,oldmateG,7,1757902147.0,Ticketek is and always has been diabolical.
ne9yfob,Pleasant_Emergency_2,7,1757901294.0,Logged on at 0830. 20380 in front of me. Got in at 0950. No tix left. Who knew there was a wait queue?
neatvb1,p3tr0110v3r,6,1757915054.0,">“There’s a special place in hell for ticketek. As footy fans we are all hostage to the most unaccountable organisation in public life in this country. A company that never speaks to its customers, never acknowledges the pain and always claims to be doing a great job. Just a faceless organisation that treats us with absolute contempt because we have no other option of dealing with anybody else. Worse than QANTAS, worse than Public Transport Victoria, just glib statements that pass the buck and screw you over. It’s scandalous. I’d love to have the chief executive of ticketek front up and answer your questions but who would even know who that is. Be damned ticketek. Be damned straight to hell.”"
ne9r8eg,Professional-Kiwi176,4,1757898723.0,"Yeah I heard of a guy who was near the front of the queue and got bumped! Terrible!

I was very lucky to get tickets for the MCC including a visitor one for Q40 which will be good, but man was it stressful.

Am worried a bit for the Ashes this year when the Member’s tickets come on sale!"
ne9tn0c,Necessary_cat735,3,1757899584.0,"The waiting room was open last night ...bloody stupid, as if ticketek wouldn't kick you out anyway for timing out at some point"
nea5u9z,Pristine_Crazy_9870,4,1757904031.0,The waiting room is a far queue.
neaf8z5,ehdhdhdk,4,1757907798.0,When demand outstrips supply people will always be disappointed.
nealbv8,Suspicious-Gift-2296,3,1757910617.0,Personally I’d rather camp out in front of the newsagents or whatever like in the 90s.
nebk1pa,SwansPrincess,4,1757930847.0,"Same shit every single year but Ticketek just charges everyone a lot of money but don’t invest in improving their platform. And it’s not just selling afl tickets, but everything. They literally have one job to do and they are so shit at it."
ne9mm1o,Infamous_YoYo,7,1757897076.0,"Irrespective of how bad Ticketek is, Ticketek > Ticketmaster any day. "
ne9kr0s,reofi,3,1757896390.0,"Trying to decipher what Ticketek is telling me. If you select GA but theres no next option, then its exhausted?"
nea3bwr,Bocca013,3,1757903092.0,Don’t worry Ticketmaster are just as bad in that department. Case in point Aus GP on sale
ne9u2oe,lizard-breather,2,1757899738.0,"And guess what, you were probably in front of someone who logged on at 8.30"
neb8y0q,imakemoremoneythanya,2,1757923972.0,Got money taken out of my account then 5mins later refunded. 5mins later tickets exhausted couldn't get any thanks ticketek 👌
necb1wz,Trash-Lexicon-5105,2,1757942389.0,Lol I have heard a few stories of people just actually going to the office and just getting their clerks to book tickets (could be Ticketmaster) too though?
ne9nt1f,Aussie_star,1,1757897499.0,"Ticketek in my opinion, is a hopeless company 
They overprice,offer poor service and as you say, don't seem to inform"
ne9tf2n,asterpin,1,1757899505.0,"I joined the queue about 10 minutes beforehand, once on laptop and once on phone mobile data (I've heard they're separate queues). 8000th in line on laptop and 3000th on phone. Managed to snag a visitor ticket for a mate luckily. Ticketek raised the bloody transaction fee again too."
neayi0h,Stonp,1,1757917666.0,"Even worse for me. I jumped on at 9:55 to buy my Geelong hawks tickets and thinking they’d queue me when the sale started at 10am…. 41k spot in the queue 😱

Still manages to get Level 4, 5th Row on the 50m wing so wasn’t too bad, but I was absolutely gobsmacked it didn’t do an auto queue at 10am instead of queuing everyone before 10am"
neb1dq9,watchyerback90,1,1757919330.0,Is there any chance at all to get public reserve tickets?
neb9tjs,chetcherry,1,1757924551.0,Should be random at 9am and a queue from 9:02.
nebg9wo,tw00013,1,1757928617.0,"Joined the haw/gee members Que at 9:59 this morning, & was #45,000th in the queue.. bit annoyed that there was a queue before the 10am opening (would have logged in earlier if I’d known).. Even joined on the wives phone to see if it was random and she was about 49,000th a few mins later. 

Managed to get tickets on my phone about 11am."
negmunr,No-Bison-5397,1,1757991749.0,"I was waiting in the queue for hours before it opened and then it timed me out and I ended up at the back.

Still got tickets but a joke."
negw9pu,None,1,1757995697.0,[deleted]
neh75x1,winterpassenger69,1,1758000949.0,My team don't go to the G much these days so have a question. Does mcg actually have any good standing spots u can go if u have seats but not together. Marvel has some great options the view bar the standing room on the wing on level 2 and under each scoreboard on l3 plus the entire bottom level. My memory of the mcg is there are pokie reserved terrace things only. Are there any actual nice spots that won't be reserved
nehlior,Jackomillard15,1,1758009299.0,"I’m sorry to mention this but the queue is completely random, has nothing to do with how long you’ve been in there. if you have multiple devices it’s best to use them to try increase ur chances of getting tickets"
ne9l1hj,Perfect_Response_752,1,1757896498.0,MCC tickets go on sale at 2pm
nea9xs7,cynictoday,1,1757905606.0,I have always had better luck getting tickets through ticketek by using 4G on my phone. It always consistently gets in before my laptop does on work or home wifi.
neb1oty,John4787,0,1757919505.0,"I jumped on the “queue before the real queue” SUNDAY at 3:47 for the Cats v Hawks game ( see pic ) . Got into the real queue @ 9:00 this morning, got my tickets at 9:30.  Can’t replicate the queuing system now though ..

https://preview.redd.it/ci1npcwk1apf1.jpeg?width=5712&format=pjpg&auto=webp&s=75adf33f35d5352802be28d042d96175226ae546"
ne9k0w9,lemonzestyveryfesty,36,1757896124.0,Yep random queue position allocation
ne9k4p7,ratchetsaturndude,15,1757896163.0,Yeah that’s what I’ve always thought. What’s the point in a waiting room before the queue if it’s going to be ordered. That would just be a queue before the queue
ne9oxgt,hamleyn248,-5,1757897895.0,"If that's true, what a joke. I may as well just get in the waiting room a few minutes beforehand."
ne9pa0n,Trabb_,10,1757898016.0,"This just happened to me, infuriating "
nea6civ,Sonofaconspiracy,9,1757904223.0,This happened to me this morning. Went from having level 1 on the wing to settling for level 4 behind the goals. Still could be worse but just fucking infuriating. Plus having to sit in que for another hour
neadbm9,Current-Attempt-6504,3,1757906969.0,Yes just happened to me as well!
neaib3n,Final_March_927,3,1757909169.0,Just happened to me too .... Cat 1 tickets to Cat 4 after being plonked at the back of the queue.
neacf0g,hamleyn248,18,1757906588.0,"Agree - I think you should not be able to take visitors to prelims, particularly if there are 2 Victorian teams in it."
ne9rowg,Professional-Kiwi176,15,1757898887.0,Man I sorta long for the pre-internet days where you’d camp out a couple of days before at the ticket window to get them.
ne9vip8,SnappyPies,3,1757900253.0,"Somewhat difficult if you’re trying to get a guest ticket for your kid, but (I’m also MCC) definitely better than a sell-out meaning no chance of getting in."
nef4t8c,Flinderspeak,1,1757972709.0,"I’m mentally preparing to queue from 10pm Friday if it’s a Geelong v Collingwood grand final and I don’t come out in the ballot. I’ve done overnights previously, but I was much younger then."
ne9ws6v,hamleyn248,-7,1757900702.0,Then why not explicitly say that somewhere? That information is literally nowhere I could find.
negqtb7,Acceptable_Burrito,1,1757993343.0,"The strange thing is, they only have one job and one purpose: to sell tickets to events. It’s also the one thing they manage to categorically fuck up on a consistent basis."
nea04tm,hamleyn248,1,1757901907.0,Apparently its random. Not that you can find that anywhere on the Ticketek website.
neaxw20,hamleyn248,1,1757917315.0,"Bahahaha, absolutely love this response!"
nebaahg,Reelgoodspeler,1,1757924855.0,And despite their contemptuous approach and our time wasted in the “queue” and other recurrent problems we pay them a fee for our troubles. Couldn’t agree more that they’re just avaricious bastards
nebd7qa,Inevitable-Seesaw176,1,1757926693.0,No its just far queued
neal3sr,BusinessPooh,6,1757910506.0,"Fuck Ticketmaster, making me individually select tickets to the F1 only for them to disappear because someone else claimed them first. Just give me best available."
neautrl,gooduxer,2,1757915584.0,"If they genuinely want to make the AFLW easier to access they should drop the Ticketmaster contract yesterday. I know all the membership systems are run through it across the league but f me dead HOW is it so hard to either access member tickets or just buy regular ass adult tickets???

I've also still not forgiven them for signing me up to the Swans membership mailing list even though I ticked ""do not sign me up"" and ""I do not support this team""."
ne9ozwo,hamleyn248,1,1757897919.0,Haven't had to use Ticketmaster for a long time. Are they still around?
ne9p5ib,hamleyn248,1,1757897973.0,"Yeah, I just tried Googling the answer to my own question and there's literally nothing you can find. Doesn't tell you when the waiting room opens, doesn't tell you how they're allocated, it's just complete BS."
nefv9ck,Aus_trader_1,3,1757981850.0,"This gives me hope for the lions tickets. In the queue, started at 35k, currently at 22k in the queue."
nehe9pz,PKMTrain,2,1758004927.0,The line stops a certain time from when they go on sale.
nehkf3i,Ecstatic-Warthog3558,1,1758008612.0,Did you click on the Are you still with us.
neh58p0,PainAintMyThing,2,1757999947.0,Nah you're absolutely cooked lad.
neh5rlz,hamleyn248,1,1758000215.0,I think they'll ask for ID...
neh739w,winterpassenger69,1,1758000910.0,I work at Marvel we have really cracked down on this recently including internal radio coms to stop u trying another gate. Mcg might not be same. U may be able to upgrade at ticket officr
neh8vo1,Groomy_,1,1758001877.0,You will be fine
ne9llv9,Footyguru856,9,1757896704.0,9am Melbourne time MCC went on sale
ne9msuu,reofi,1,1757897142.0,Get in the waiting room before 2 or miss out. No guarantees either if you queue
ne9mpqq,Wetrapordie,39,1757897112.0,"Yes, there’s an article from when Taylor Swift was selling tickets that basically said it’s a lottery.

“Ticketek has admitted its booking system isn’t actually a queue but more like a lottery. Punters on social media reported confusion around the ticketing process; some who had been waiting on a loading screen since opening were left without tickets, while others who logged on well after were able to quickly secure seats.

That’s because Ticketek doesn’t allocate tickets on a first come, first served basis. Rather, once a person has logged into the waiting “lounge”, they are picked at random.”"
ne9on0a,hamleyn248,-16,1757897795.0,Completely agree. I also don't see how that is at all fair. Why should I get penalised for being organised and in the Waiting Room well before someone by having it random? Seems completely ridiculous. I know it's also a bit conspiracy theory-like but I reckon they must give preferential treatment to some because I never get in anywhere near close to the front of the line.
ne9uce5,prettytopsayebro,24,1757899833.0,Isn’t that a good thing?
ne9prgx,JRicho_Sauce,15,1757898191.0,"But if it’s not random then it’s not really a waiting room is it? It’s just an earlier queue.

I believe the waiting room is used to weed out bots and ensure the site doesn’t crash when tickets go live "
neb5d1c,mildCombustion,0,1757921691.0,Yes 😂 that's the whole point dude.
neazmkl,HikerSaint,7,1757918318.0,"Give the amount of full, restricted and probationary members that exists its frankly ridiculous that visitor tickets can be purchased for games like this"
ne9xkvk,AlexJokerHAL,16,1757900984.0,At least your spot in the queue is visible and transparent.
nea26r4,nuffiealert,12,1757902665.0,Why does it need to be said? It’s just how the random system works. You aren’t special cause you logged in 1 hour early.  It’s not 1985 like concert tickets
neaad4q,Aggressive_River_735,3,1757905774.0,It literally says it on the waiting page. You could have been reading it over and over for forty minutes.
nehlty6,Jackomillard15,1,1758009492.0,It takes 1 google search mate
ne9peu1,Infamous_YoYo,4,1757898065.0,"It depends on the venue/stadium. A number of stadiums around the country use Ticketmaster 😩




Had to use it for the Giants v Hawks game and it was a horrendous experience. 


Also doesn't let you choose which section/bay to sit in for finals whereas Ticketek does. "
ne9uhv8,proudlysydney,4,1757899886.0,"Yeah, they're the channel for many AFL venues and the Australian Grand Prix- which is a nightmare to get tickets to beyond AFL finals any day."
ne9y2z0,Shadormy,2,1757901166.0,"Yep, and it's pretty much the same. Gabba uses it, went to Lions/Suns, went in the waiting room 15 mins before, randomly placed in line (which they do tell you and say it doesn't matter when you get into the waiting room), was 7000th, had the added fun/bug of entering authentication codes every few mins."
nefyzr3,Stonp,1,1757983185.0,My mate also got rekt in the Lions queue. Idk what happened and why it changed from yesterday…?
ne9m5ze,Jawdanc,9,1757896911.0,You're talking about different games
ne9nieu,Perfect_Response_752,3,1757897396.0,My bad. I thought both games went on sale at the same time.
ne9rsy5,flibble24,10,1757898926.0,"Yeah I remember trying to get grand final tickets in that COVID year in Perth. Went from waiting room to 590,000 in queue, in like 5 seconds.

I was annoyed until I understood it. Not sure why ticket companies don't just be honest about the process"
nea4h0r,Grolschisgood,3,1757903530.0,"I appreciated this with the Taylor Swift tickets because there were big outages and site issues due to the amount of traffic. If it was truly queue based that would have been just as unfair because even if you got in line days before, the site could crash through no fault of your own and then you would be at the back of the queue."
nehecpk,ZestyBro,3,1758004975.0,The process is different now than for TS tickets. TS ticket queue it just refreshed every 10 seconds and if there was a free slot you got in. Now you go into a waiting room and then when the on sale time starts you get put into a proper queue (they say randomly)
ne9u4yz,proudlysydney,22,1757899760.0,"It's actually fairer to avoid bots that are able to log in to the waiting room within milliseconds of it opening. By making it random, you also disincentivise people overwhelming the load on the website for ages before the queue really opens. If the 'waiting room' is just another, earlier queue, then you'll end up with thousands of people all trying to log in exactly when it opens, rather than this way, people stagger entry knowing that the time they enter doesn't impact their position in the queue."
ne9sybn,ratchetsaturndude,12,1757899336.0,I don’t think we’re on the same page. Randomly generating the queue order from the waiting room is the best way to keep it fair.
ne9wmxs,hamleyn248,-2,1757900651.0,Surely they have a better way of avoiding bots? I don't think people should be penalised for being organised and getting into the queue as early as possible. I've also never been put anywhere near the front of the queue.
nef4r3i,Professional-Kiwi176,2,1757972690.0,"Only Full and Restricted members can go to Prelims, probationary members don’t really get much (am Restricted Member myself and got tickets)."
ne9xpxf,Professional-Kiwi176,5,1757901035.0,"Yep, and also a bit of fun to tell the tales of camping out for tickets to one of the biggest games of all!"
neauw8h,BustedWing,2,1757915621.0,"Id have thought its a fairer system - first in line means first in line, and if someone was prepared to (electronically speaking) camp out to get to the front, more power to them, no?"
neazng6,glenngillen,1,1757918331.0,Because it currently implies the opposite: “you are 25000”. Your position number is apparently irrelevant.
neac9ya,hamleyn248,0,1757906531.0,"It's about transparency. I lost 40 minutes of my life trying to keep the page open and saying I was still there only for it to mean nothing. Just tell me that it doesn't matter when you get into the waiting room, you'll randomly be put into a spot in the queue."
neabshf,hamleyn248,1,1757906337.0,It says you will be placed in the queue automatically. It doesn't say it's randomly generated.
nea0hd6,hamleyn248,1,1757902033.0,Good that Ticketmaster tell you about it being random. I couldn't see that anywhere on the Ticketek website though.
negtu5a,BusinessPooh,1,1757994631.0,"Yesterday had MCC on sale from 9am so that's when the queue opened, the Collingwood Lions MCC sale was yesterday so the first sale was for Club Members hence why the queue opened at 10 instead."
ne9mepr,Footyguru856,3,1757897001.0,"Yep, assumed this post was about the Geelong hawks game"
ne9ucdi,LeDestrier,31,1757899833.0,"Ticket companies

Be honest

![gif](giphy|G3w5bFfY85rag|downsized)"
ne9wfzq,hamleyn248,-2,1757900581.0,"I get that but surely there's a better way to protect from bots than this? They must have a better option as it seems really unfair that someone can be organised enough to get into the waiting room 40 minutes before the tickets open only to be dumped right near the back of the queue (I was number 18,000 or so in the end and didn't get tickets)."
neb5637,hamleyn248,2,1757921572.0,"Then they should explicitly state that. It's not on the page you're waiting on, only that you'll be automatically added to the queue."
neafe2u,TBNK88,7,1757907860.0,"You’re not penalised for joining the waiting room early, you’re just not rewarded for it either."
negjnr7,Opening_Anteater456,1,1757990524.0,"Nope they sold visitor tickets, not sure how many but more than 0"
negkoz5,Swimming-Session8806,1,1757990914.0,Could buy one visitor ticket till sold out. After that its just FM and RM till they all sold out. Then FM and RM on the day. PM get no access to finals
ne9zjtt,AlexJokerHAL,3,1757901694.0,For sure. I slept out at Eastland for tickets one year. Was a mission.
neb1ls6,nuffiealert,2,1757919457.0,"No of course not. We all pay the same. Some like me, pay more than most members. I don’t expect better treatment over the level of my membership.  Most people have work and other responsibilities. We aren’t all teenagers capable of sitting in front of a PC for hours before the start time arrives."
neb1qro,nuffiealert,0,1757919536.0,All of that is horseshit.
neb14hq,nuffiealert,0,1757919186.0,That’s life mate. You learned like the rest of us and next time hopefully won’t waste time worrying about it.
neh3ae6,Stonp,1,1757998968.0,Ah that makes a lot of sense!
neah7fj,Subzero_AU,8,1757908664.0,In before honesty surcharge
nehgtyz,proudlysydney,2,1758006423.0,"This is literally the fairest way. If you’re “organised enough” to be there 40 min early then there’s gonna be people getting there 50, and then if they miss out or they hear oh I was there 50 min early, then next time they go 60, and so on and so on until you’ve got thousands of people trying to log in at the second the waiting room itself opens. The whole point is that you *don’t* need to be organised to be there ridiculously early at some arbitrary time- as long as you’re in by the time specified, you’ve got the same chance as everyone else. That’s fair as fair. "
neaj3qq,hamleyn248,-2,1757909542.0,Disagree - it's time you'll never get back because Ticketek isn't transparent.
nea057b,Professional-Kiwi176,1,1757901911.0,But definitely worth it!!!
neb7qcd,BustedWing,-1,1757923155.0,"Should those with lower incomes be afforded a discount on your membership level, given they don’t have the same earning potential as you?

What about those with higher expenses than you?"
neb21hh,glenngillen,1,1757919705.0,It doesn’t say what number you are in the waiting room?
neb5jih,mildCombustion,1,1757921800.0,I am very confident that the fact your position in the queue from the waiting room is randomly generated. I was buying tickets to the Melbourne F1 GP which has the same process and it was made clear that your queue position is randomly generated
neb8wly,nuffiealert,3,1757923944.0,I don’t understand the question. What has this got to do with access to tickets through a paid membership?
neb2k8b,nuffiealert,0,1757920010.0,"Won’t matter if it does. It won’t be an accurate reflection of the truth. Besides all of that, you can be kicked out at any point and miss out. It’s so random.  Just the way it goes these days buying tickets for high demand events."
neb5ulb,hamleyn248,0,1757921988.0,It doesn't say that in the waiting room for the AFL though. Just that you will be added to the queue automatically.
neb9ea3,BustedWing,-1,1757924273.0,"Your position was that your life circumstances meant it was unfair to you if someone else’s life circumstances meant they could devote more of their time than you to lining up for tickets, thereby putting them in front of you in the queue.

“Not everyone can sit in front of their computer” you say.

I was wondering if that logic applied to other aspects of your life circumstances, like access to disposable income?

Should other people, with different life circumstances to you, be given a leg up to ensure they have the same chance as you at tickets?"
neb90mv,identikit12,0,1757924023.0,It also doesn't say that isn't the case
neboian,nuffiealert,3,1757933240.0,"What a bizarre narrative you have created there. 😂

Enjoy the game lad. Cheers"
nebaa9z,hamleyn248,0,1757924851.0,Thanks. That's super helpful. You know what they say about assumptions?
nebu4eu,BustedWing,0,1757935896.0,"I mean, if you say so!"
nebafmy,identikit12,1,1757924947.0,I do - and you’re the only one who assumed anything.
nebw6ii,nuffiealert,1,1757936796.0,I just did
